"页面网址","标题","字段3","时间","字段5","字段6","字段7","字段8","字段9"
"https://landing.toutiao.com/i6415754592293749249/","孕妇留长发会和胎儿抢营养么？","每日穿衣搭配师","2017-05-03 12:04:31","大多数孕妈知道自己怀孕时都会选择到美发店建一个利落的短发，因为自己腹中的宝宝需要很多营养，怕被浓密的秀发“抢走”。虽然有百般不舍，但为了孩子，很多妈妈还是选择剪掉。那么我们的头发真的会“抢走”供给宝宝的营养么？","<p>本文原创，欢迎个人分享转发，媒体转载请联系作者</p><p>作者丨yimibama：知更鸟</p><p>大多数孕妈知道自己怀孕时都会选择到美发店建一个利落的短发，因为自己腹中的宝宝需要很多营养，怕被浓密的秀发“抢走”。虽然有百般不舍，但为了孩子，很多妈妈还是选择剪掉。那么我们的头发真的会“抢走”供给宝宝的营养么？</p><p><img src=""http://p9.pstatp.com/large/1dc800004499535ce847"" img_width=""376"" img_height=""276"" alt=""孕妇留长发会和胎儿抢营养么？"" inline=""0""></p><p><strong>头发生长靠什么？</strong></p><p>我们的毛发大概分为毛囊、毛干两部分，而毛囊和毛根结合的地方会在头皮下形成一个彭起的毛球，这个毛球才是毛发汲取营养的部分。而我们能“看到”的头发是毛球吸收营养后长出的毛干，是发根吸收营养后“合成”的产物，本身不会有代谢和消耗了。所以我们的秀发是不会抢走宝宝的营养的，应该说单纯剪掉头发是不能遏制毛发生长所需要消耗的部分。所以为这个理由而剪掉长发的妈妈们可以再考虑一下！</p><p><img src=""http://p9.pstatp.com/large/1dc5000319e07184c5d0"" img_width=""550"" img_height=""356"" alt=""孕妇留长发会和胎儿抢营养么？"" inline=""0""></p><p><strong>头发生长能抢走胎儿的营养么？</strong></p><p>答案是不会的。母体会优先为胎儿发育配置所需要的营养，毛发生长过程中需要的部分微乎其微，并不足以影响胎儿发育。所以妈妈们无需为此担心。</p><p><img src=""http://p3.pstatp.com/large/1dc8000044bf182f4bd3"" img_width=""524"" img_height=""644"" alt=""孕妇留长发会和胎儿抢营养么？"" inline=""0""></p><p>由于孕期妈妈和产后妈妈行动不便，不能够经常清理头发，剪掉长发会让妈妈们更加舒适。所以基于这一点，很多妈妈选择了剪掉长发，可不是为了“节约”营养哦。</p>","本文原创，欢迎个人分享转发，媒体转载请联系作者作者丨yimibama：知更鸟大多数孕妈知道自己怀孕时都会选择到美发店建一个利落的短发，因为自己腹中的宝宝需要很多营养，怕被浓密的秀发“抢走”。虽然有百般不舍，但为了孩子，很多妈妈还是选择剪掉。那么我们的头发真的会“抢走”供给宝宝的营养么？头发生长靠什么？我们的毛发大概分为毛囊、毛干两部分，而毛囊和毛根结合的地方会在头皮下形成一个彭起的毛球，这个毛球才是毛发汲取营养的部分。而我们能“看到”的头发是毛球吸收营养后长出的毛干，是发根吸收营养后“合成”的产物，本身不会有代谢和消耗了。所以我们的秀发是不会抢走宝宝的营养的，应该说单纯剪掉头发是不能遏制毛发生长所需要消耗的部分。所以为这个理由而剪掉长发的妈妈们可以再考虑一下！头发生长能抢走胎儿的营养么？答案是不会的。母体会优先为胎儿发育配置所需要的营养，毛发生长过程中需要的部分微乎其微，并不足以影响胎儿发育。所以妈妈们无需为此担心。由于孕期妈妈和产后妈妈行动不便，不能够经常清理头发，剪掉长发会让妈妈们更加舒适。所以基于这一点，很多妈妈选择了剪掉长发，可不是为了“节约”营养哦。","怀孕孕产育儿","育儿"
"https://landing.toutiao.com/i6415755387433124354/","哺乳如上刑丨有一种痛，叫乳头皲裂……","2017-05-03 12:07:36",,"乳头皲裂，即乳头被嘬伤，看似是一件不太起眼的小事。但实际上，比起乳腺炎、母婴分离等，更易成为妈妈们母乳之路上的障碍。乳头皲裂后，哺乳如“上刑”，还极易愈后复发，今天小爱就跟宝妈们聊聊“乳头皲裂”，俗话说“知己知彼，方能百战不殆”嘛。","<p>母乳喂养的好处已经无需小爱在多说些什么了，从越来越的妈妈都开始坚持母乳喂养就能看出来。但是母乳喂养并不是一件轻松的事，“奶水少、不出奶、乳头皲裂...”等等问题或多或少都会出现在新手妈妈的母乳喂养日常中。</p><p><img src=""http://p9.pstatp.com/large/1dc400004a4f1ae7e9fb"" img_width=""640"" img_height=""362"" alt=""哺乳如上刑丨有一种痛，叫乳头皲裂……"" inline=""0""></p><p>乳头皲裂，即乳头被嘬伤，看似是一件不太起眼的小事。但实际上，比起乳腺炎、母婴分离等，更易成为妈妈们母乳之路上的障碍。乳头皲裂后，哺乳如“上刑”，还极易愈后复发，今天小爱就跟宝妈们聊聊“乳头皲裂”，俗话说“知己知彼，方能百战不殆”嘛。</p><p><img src=""http://p1.pstatp.com/large/1dc400004a60f8e040f4"" img_width=""343"" img_height=""240"" alt=""哺乳如上刑丨有一种痛，叫乳头皲裂……"" inline=""0""></p><p><strong>「乳头皲裂」的原因</strong></p><p>乳头皲裂，是指哺乳期妈妈乳头表面发生了小裂口、出血等情况。乳头皲裂很容易出现在孩子出生的第一个月，以及宝宝乳牙萌发期是咬伤妈妈最常见时期。</p><p>造成宝妈乳头皲裂的常见原因如下：</p><p>☑喂奶姿势不正确；</p><p>☑乳汁太多太少；</p><p>☑宝宝萌芽期牙龈按摩刺激不够；</p><p>☑乳头条件不好：乳头内陷、短小、巨大、皮肤太过娇嫩。</p><p>乳头上含有丰富的血管神经，一旦发生乳头皲裂，宝宝的每一次吸吮，都会给妈妈带来剧烈的疼痛。短时间也许还能忍受，但时间一长难免会让妈妈们萌生退意，为了减轻痛苦，有些妈妈只能无奈减少喂奶次数，或是不喂奶。</p><p><img src=""http://p3.pstatp.com/large/1dbe000320044c900591"" img_width=""640"" img_height=""627"" alt=""哺乳如上刑丨有一种痛，叫乳头皲裂……"" inline=""0""></p><p><strong>「乳头皲裂」预防最重要</strong></p><p>乳头皲裂常常会反复发作，为了宝宝的母乳，也为了妈妈喂奶不痛苦，得学会如何预防！其中，正确的喂养姿势就是有效预防乳头皲裂的最佳方式。宝宝正确含接乳头，也能让妈妈哺乳时更舒适。小爱提示宝妈们，不论采取哪种哺乳姿势，都要注意这四点：</p><p>☛宝宝的头和身体在一条直线上；</p><p>☛宝宝的脸贴近乳房，鼻子对着乳头；</p><p>☛宝宝身体贴近妈妈，含住大部分乳晕；</p><p>☛如果是新生儿，不仅要托住其头部和肩部，还要托住臀部。</p><p>除了正确哺乳，还要注意乳头清洁：每次喂奶前后可用温水轻轻洗净乳头、乳晕，擦干后涂抹乳头修护霜，保持乳头周围皮肤的清洁和滋润，降低发生裂口的可能。</p><p><img src=""http://p1.pstatp.com/large/1f7b000042fd74aff90b"" img_width=""350"" img_height=""200"" alt=""哺乳如上刑丨有一种痛，叫乳头皲裂……"" inline=""0""></p><p><strong>万一乳头还是破了，怎么办？</strong></p><p>避免乳头不受伤当然是最好的，但有时受伤总是“在所难免”。如果不幸受伤，宝妈们千万不要硬撑着给宝宝喂奶，可以试试下面的方法来减轻痛苦。</p><p>1、提前刺激下奶：喂奶前，先用毛巾热敷，按摩乳房刺激乳汁分泌，挤出少量奶水使乳晕变软，易于宝宝含接乳头。</p><p>2、有顺序的喂奶：喂奶的时候先选没受伤或是受伤较轻的一侧，并经常变换喂奶姿势，以减轻用力吸吮对乳头的刺激。</p><p>3、保护乳头皮肤：每次哺乳完可以挤点奶水涂抹在乳头及乳晕上自然干，或者涂抹乳头修护霜来保护乳头，另外佩戴母乳保护罩（硬质）也是个不错的选择。</p><p><img src=""http://p3.pstatp.com/large/1dca00031eaff9712683"" img_width=""672"" img_height=""372"" alt=""哺乳如上刑丨有一种痛，叫乳头皲裂……"" inline=""0""></p><p>4、避免乳头牵拉：宝宝咬住奶头的时候，不要直接将乳头拽出，可以尝试把宝宝抱紧，用乳房的其余部分贴近宝宝的鼻子，让宝宝暂时没法用鼻子呼吸，自然就松嘴了。</p><p>5、及时寻求帮助：如果裂口老是好不了或反复发作，别犹豫啦，及早去医院就诊。让医生诊断，了解皲裂的原因，才能对症指导、用药。</p><p>6、必要时减少吸吮：如果裂口疼得厉害，就减少亲喂；也可佩戴软性母乳保护罩，避免喂养时乳头与宝宝直接接触；还可以用手挤出奶水，或用吸奶器吸奶，等伤口愈合后再亲自喂养。</p><p><img src=""http://p3.pstatp.com/large/1f7b000043359ec81356"" img_width=""672"" img_height=""377"" alt=""哺乳如上刑丨有一种痛，叫乳头皲裂……"" inline=""0""></p><p>好了，关于乳头皲裂的话题，小爱就分享到这里。最后提醒各位宝妈，就算乳头皲裂，也不能轻易放弃母乳喂养哦！因为无论科技怎么发达,天然的总会比用科学合成的更好！</p>","母乳喂养的好处已经无需小爱在多说些什么了，从越来越的妈妈都开始坚持母乳喂养就能看出来。但是母乳喂养并不是一件轻松的事，“奶水少、不出奶、乳头皲裂...”等等问题或多或少都会出现在新手妈妈的母乳喂养日常中。乳头皲裂，即乳头被嘬伤，看似是一件不太起眼的小事。但实际上，比起乳腺炎、母婴分离等，更易成为妈妈们母乳之路上的障碍。乳头皲裂后，哺乳如“上刑”，还极易愈后复发，今天小爱就跟宝妈们聊聊“乳头皲裂”，俗话说“知己知彼，方能百战不殆”嘛。「乳头皲裂」的原因乳头皲裂，是指哺乳期妈妈乳头表面发生了小裂口、出血等情况。乳头皲裂很容易出现在孩子出生的第一个月，以及宝宝乳牙萌发期是咬伤妈妈最常见时期。造成宝妈乳头皲裂的常见原因如下：☑喂奶姿势不正确；☑乳汁太多太少；☑宝宝萌芽期牙龈按摩刺激不够；☑乳头条件不好：乳头内陷、短小、巨大、皮肤太过娇嫩。乳头上含有丰富的血管神经，一旦发生乳头皲裂，宝宝的每一次吸吮，都会给妈妈带来剧烈的疼痛。短时间也许还能忍受，但时间一长难免会让妈妈们萌生退意，为了减轻痛苦，有些妈妈只能无奈减少喂奶次数，或是不喂奶。「乳头皲裂」预防最重要乳头皲裂常常会反复发作，为了宝宝的母乳，也为了妈妈喂奶不痛苦，得学会如何预防！其中，正确的喂养姿势就是有效预防乳头皲裂的最佳方式。宝宝正确含接乳头，也能让妈妈哺乳时更舒适。小爱提示宝妈们，不论采取哪种哺乳姿势，都要注意这四点：☛宝宝的头和身体在一条直线上；☛宝宝的脸贴近乳房，鼻子对着乳头；☛宝宝身体贴近妈妈，含住大部分乳晕；☛如果是新生儿，不仅要托住其头部和肩部，还要托住臀部。除了正确哺乳，还要注意乳头清洁：每次喂奶前后可用温水轻轻洗净乳头、乳晕，擦干后涂抹乳头修护霜，保持乳头周围皮肤的清洁和滋润，降低发生裂口的可能。万一乳头还是破了，怎么办？避免乳头不受伤当然是最好的，但有时受伤总是“在所难免”。如果不幸受伤，宝妈们千万不要硬撑着给宝宝喂奶，可以试试下面的方法来减轻痛苦。1、提前刺激下奶：喂奶前，先用毛巾热敷，按摩乳房刺激乳汁分泌，挤出少量奶水使乳晕变软，易于宝宝含接乳头。2、有顺序的喂奶：喂奶的时候先选没受伤或是受伤较轻的一侧，并经常变换喂奶姿势，以减轻用力吸吮对乳头的刺激。3、保护乳头皮肤：每次哺乳完可以挤点奶水涂抹在乳头及乳晕上自然干，或者涂抹乳头修护霜来保护乳头，另外佩戴母乳保护罩（硬质）也是个不错的选择。4、避免乳头牵拉：宝宝咬住奶头的时候，不要直接将乳头拽出，可以尝试把宝宝抱紧，用乳房的其余部分贴近宝宝的鼻子，让宝宝暂时没法用鼻子呼吸，自然就松嘴了。5、及时寻求帮助：如果裂口老是好不了或反复发作，别犹豫啦，及早去医院就诊。让医生诊断，了解皲裂的原因，才能对症指导、用药。6、必要时减少吸吮：如果裂口疼得厉害，就减少亲喂；也可佩戴软性母乳保护罩，避免喂养时乳头与宝宝直接接触；还可以用手挤出奶水，或用吸奶器吸奶，等伤口愈合后再亲自喂养。好了，关于乳头皲裂的话题，小爱就分享到这里。最后提醒各位宝妈，就算乳头皲裂，也不能轻易放弃母乳喂养哦！因为无论科技怎么发达,天然的总会比用科学合成的更好！","母乳喂养新生儿护肤推拿育儿锦囊","育儿"
"https://landing.toutiao.com/i6415754502967656961/","新生儿对光线的刺激十分敏感，光线突然加强，宝宝的瞳孔就会缩小","育儿教子","2017-05-03 12:04:10","一、宝宝出生后，他眼睛朝向发光处，但不会追随光源移动；","<p><img src=""http://p1.pstatp.com/large/1f7b00003f31fcd8da1e"" img_width=""600"" img_height=""388"" alt=""新生儿对光线的刺激十分敏感，光线突然加强，宝宝的瞳孔就会缩小"" inline=""0""></p><p>新生儿对光的刺激十分敏感。刚出生的宝宝还不能对发光或只发声的物体作出反应，只能对同时既发光又发声并活动的物体表现出模糊的笼统的反应</p><p>一、宝宝出生后，他眼睛朝向发光处，但不会追随光源移动；</p><p><span>二、当光和声音同时出现了5～6秒钟后，宝宝才把头转向发出光和声响的方向。</span></p><p>这也就是说，这时的新生儿只能用全部感觉器官来接受整体性的刺激，这种带有原始意义的整体性，在新生儿的行为中屡见不鲜。</p><p>新生儿对光的刺激十分敏感。他们不但会在睁着眼睛时对光线的明暗变化作出反应，甚至在闭着眼睛打瞌睡时只要一开灯，也会有反应。</p><p><img src=""http://p3.pstatp.com/large/1dc8000046214a8e861a"" img_width=""400"" img_height=""300"" alt=""新生儿对光线的刺激十分敏感，光线突然加强，宝宝的瞳孔就会缩小"" inline=""0""></p><p>宝宝出生后的头几天内还可以观察到环境状态：</p><p>一、当眼前有光在闪烁时，宝宝就会眯起眼睛；</p><p>二、如果光线突然加强，宝宝的瞳孔就要缩小。</p><p>所有这些反应都是为了“躲避”对眼部刺激，或者是减轻刺激的影响。</p><p>其实，新生儿不仅能“躲避”刺激，他也寻求刺激。</p><p><img src=""http://p1.pstatp.com/large/1f7b0000416b930a9134"" img_width=""640"" img_height=""479"" alt=""新生儿对光线的刺激十分敏感，光线突然加强，宝宝的瞳孔就会缩小"" inline=""0""></p><p>在产院婴儿室里对新生儿进行观察的人会发现，大多数宝宝的脸就像向日葵一样总是向着光亮的一面。</p><p>此外，还可以肯定，宝宝生下来几天就能用眼睛追踪缓慢移动的光源了。</p><p>但是，新生宝宝虽然有了视觉能力，但却是很微弱的。强光线会使宝宝感到不安，因此安放新生儿的地方不宜光照过强。并且，宝宝会用哭声对强烈的光线做出反应。</p><p><img src=""http://p3.pstatp.com/large/1dc80000476ac51be68d"" img_width=""400"" img_height=""300"" alt=""新生儿对光线的刺激十分敏感，光线突然加强，宝宝的瞳孔就会缩小"" inline=""0""></p><p>欢迎订阅本号原创文章</p>","新生儿对光的刺激十分敏感。刚出生的宝宝还不能对发光或只发声的物体作出反应，只能对同时既发光又发声并活动的物体表现出模糊的笼统的反应一、宝宝出生后，他眼睛朝向发光处，但不会追随光源移动；二、当光和声音同时出现了5～6秒钟后，宝宝才把头转向发出光和声响的方向。这也就是说，这时的新生儿只能用全部感觉器官来接受整体性的刺激，这种带有原始意义的整体性，在新生儿的行为中屡见不鲜。新生儿对光的刺激十分敏感。他们不但会在睁着眼睛时对光线的明暗变化作出反应，甚至在闭着眼睛打瞌睡时只要一开灯，也会有反应。宝宝出生后的头几天内还可以观察到环境状态：一、当眼前有光在闪烁时，宝宝就会眯起眼睛；二、如果光线突然加强，宝宝的瞳孔就要缩小。所有这些反应都是为了“躲避”对眼部刺激，或者是减轻刺激的影响。其实，新生儿不仅能“躲避”刺激，他也寻求刺激。在产院婴儿室里对新生儿进行观察的人会发现，大多数宝宝的脸就像向日葵一样总是向着光亮的一面。此外，还可以肯定，宝宝生下来几天就能用眼睛追踪缓慢移动的光源了。但是，新生宝宝虽然有了视觉能力，但却是很微弱的。强光线会使宝宝感到不安，因此安放新生儿的地方不宜光照过强。并且，宝宝会用哭声对强烈的光线做出反应。欢迎订阅本号原创文章","新生儿文章婴幼儿护理育儿锦囊育儿","育儿"
"https://landing.toutiao.com/i6415753770050781697/","孕妇宝妈看过来，你的肚子里是男宝还是女宝？","2017-05-03 12:01:20",,"2017年2月2日39周我剖腹产下我家二公子，现在宝贝已经3个月了，是一个开朗活泼的小可爱，看着他一天天的长大，我真的很欣慰！","<p><img src=""http://p3.pstatp.com/large/1dc500030cf8445e4d16"" img_width=""200"" img_height=""190"" alt=""孕妇宝妈看过来，你的肚子里是男宝还是女宝？"" inline=""0""></p><p>走在大街上大肚子的孕妈一个接一个，你们在怀孕期间听到最多的话是什么，我家住镇上，每次出门遇到熟人总要被问上一声几个月了，查了没有是男孩女孩？说实话两个宝都没有查，今天给大家分享一下我怀二宝时的情况子宫后位；，25天左右就用试条测出浅浅的两条红线，妊娠线一直开到胸口，上细下粗，偏右；口味比较清淡，孕吐不是很强烈，整个孕期不喜欢吃肉；腹股沟有色素沉淀，其余地方没有，总体来说身体还算灵活。体重长了40斤，无水肿。<img src=""http://p3.pstatp.com/large/1dc80000431892f7af11"" img_width=""1722"" img_height=""2322"" alt=""孕妇宝妈看过来，你的肚子里是男宝还是女宝？"" inline=""0""></p><p>2017年2月2日39周我剖腹产下我家二公子，现在宝贝已经3个月了，是一个开朗活泼的小可爱，看着他一天天的长大，我真的很欣慰！<img src=""http://p3.pstatp.com/large/1dc8000045d3e569a8ea"" img_width=""1722"" img_height=""2322"" alt=""孕妇宝妈看过来，你的肚子里是男宝还是女宝？"" inline=""0""></p>","走在大街上大肚子的孕妈一个接一个，你们在怀孕期间听到最多的话是什么，我家住镇上，每次出门遇到熟人总要被问上一声几个月了，查了没有是男孩女孩？说实话两个宝都没有查，今天给大家分享一下我怀二宝时的情况子宫后位；，25天左右就用试条测出浅浅的两条红线，妊娠线一直开到胸口，上细下粗，偏右；口味比较清淡，孕吐不是很强烈，整个孕期不喜欢吃肉；腹股沟有色素沉淀，其余地方没有，总体来说身体还算灵活。体重长了40斤，无水肿。2017年2月2日39周我剖腹产下我家二公子，现在宝贝已经3个月了，是一个开朗活泼的小可爱，看着他一天天的长大，我真的很欣慰！","怀孕孕产育儿","育儿"
"https://landing.toutiao.com/i6415754686959190530/","宝宝长太快，可能会有“后遗症”！","2017-05-03 12:04:53",,"在门诊中，经常会有爸爸妈妈反映孩子的视力下降得怎么这么厉害，除了用眼过度以外，孩子长太快是比较常见的原因。","<p>爸爸妈妈们都希望孩子长得快一些，特别是和同龄人一比，自己宝宝又高又壮，就感觉<span>宝宝发育得好，</span><span>当爸爸妈妈的也就特别开心。但其实</span><span>0~6岁的孩子身高体重发育有一定的范围，发育太慢了不好，发育太快了也不行。</span></p><p><img src=""http://p3.pstatp.com/large/1f7b00003cfa3cf0b655"" img_width=""462"" img_height=""280"" alt=""宝宝长太快，可能会有“后遗症”！"" inline=""0""></p><p><span>在门诊中，经常会有爸爸妈妈反映孩子的视力下降得怎么这么厉害，除了用眼过度以外，孩子长太快是比较常见的原因。</span></p><p>因为近视主要是由两个关键因素决定的，即角膜曲率和眼轴长短，而这两者必须保持一个固定的比例，人体的视力才是正常的。从婴儿直到成人，一般情况下，角膜曲率是固定不变的，而眼轴也有一个从短至长的可调节空间。正常情况下，眼球发育与年龄应该匹配生长，一旦出现不匹配现象，问题就出现了。</p><p><span>孩子如果长太快，</span><span>由于脂肪、激素等的摄入，身体是长了，眼睛发育反而跟不上趟，结果不近视的变近视，近视轻的越来越重。如果伴随着用眼过度、负担过重，再遭遇发烧，视力很容易出问题。</span><span>就会影响眼轴长度，使两者比例超过正常范围，引起近视。</span></p><p><img src=""http://p3.pstatp.com/large/1dc500031a1e3c9207c7"" img_width=""437"" img_height=""257"" alt=""宝宝长太快，可能会有“后遗症”！"" inline=""0""><span></span></p><p>3岁前和5岁-7岁是孩子身高幅度长得最快的阶段，相应的眼轴变化也是最快的。这时候家长要特别注意孩子的视力变化，定期带孩子到医院检查眼睛。<span><br></span></p><p><span>对于如何预防营养不均衡导致的视力发育问题，可以从三方面入手，一方面少吃潜藏有激素等不健康成分的食品，防止身体过快发育；另一方面多食用钙质高、胶原蛋白和微量元素丰富的食品，吃饭不偏食、不挑食，并加强补充一些微量元素，确保视力的正常发育。</span></p>","爸爸妈妈们都希望孩子长得快一些，特别是和同龄人一比，自己宝宝又高又壮，就感觉宝宝发育得好，当爸爸妈妈的也就特别开心。但其实0~6岁的孩子身高体重发育有一定的范围，发育太慢了不好，发育太快了也不行。在门诊中，经常会有爸爸妈妈反映孩子的视力下降得怎么这么厉害，除了用眼过度以外，孩子长太快是比较常见的原因。因为近视主要是由两个关键因素决定的，即角膜曲率和眼轴长短，而这两者必须保持一个固定的比例，人体的视力才是正常的。从婴儿直到成人，一般情况下，角膜曲率是固定不变的，而眼轴也有一个从短至长的可调节空间。正常情况下，眼球发育与年龄应该匹配生长，一旦出现不匹配现象，问题就出现了。孩子如果长太快，由于脂肪、激素等的摄入，身体是长了，眼睛发育反而跟不上趟，结果不近视的变近视，近视轻的越来越重。如果伴随着用眼过度、负担过重，再遭遇发烧，视力很容易出问题。就会影响眼轴长度，使两者比例超过正常范围，引起近视。3岁前和5岁-7岁是孩子身高幅度长得最快的阶段，相应的眼轴变化也是最快的。这时候家长要特别注意孩子的视力变化，定期带孩子到医院检查眼睛。对于如何预防营养不均衡导致的视力发育问题，可以从三方面入手，一方面少吃潜藏有激素等不健康成分的食品，防止身体过快发育；另一方面多食用钙质高、胶原蛋白和微量元素丰富的食品，吃饭不偏食、不挑食，并加强补充一些微量元素，确保视力的正常发育。","婴幼儿护理育儿锦囊育儿","育儿"
