"标题","作者","时间","正文","标签"
"精华收藏帖：2017年澳大利亚名校优势专业排名","指南针Jason","2017-05-03 12:03:03","<p>出国留学面临最大的选择就是选学校和专业了，名校情结让人很容易优先考虑择校，然而仅仅为了进入名校却挑个自己不太喜欢/未来发展一般的专业委实不值。</p><p>那么要来澳洲留学的话，各大学的优势专业都是什么呢？ 小编给大家总结了一份详尽的澳洲名校优势专业排名列表，各位准备留学的同学千万不能错过！</p><p><img src=""http://p9.pstatp.com/large/1dc40000485d623c8ae6"" img_width=""640"" img_height=""293"" alt=""精华收藏帖：2017年澳大利亚名校优势专业排名"" inline=""0""></p><p>Accounting &amp; Finance</p><p>会计金融类</p><p>会计与金融专业是澳洲留学最热门的专业，教学质量高，且是可移民专业，每年都有成千上万的留学生赴澳学习会计与金融，因此这个专业的排名格外重要。</p><p>根据最新的QS世界大学【专业】排名显示，共有三所澳洲学校进入榜单前20，六所澳洲大学进入前50。</p><p>具体榜单如下：</p><p><img src=""http://p1.pstatp.com/large/1dc500031c94601f92a3"" img_width=""577"" img_height=""413"" alt=""精华收藏帖：2017年澳大利亚名校优势专业排名"" inline=""0""></p><p>QS专业世界排名：新南威尔士大学11，墨尔本大学14，悉尼大学20，澳洲国立大学23，蒙纳士大学26，昆士兰大学39。</p><p>蒙纳士大学 Monash University（墨尔本）</p><p>优势：蒙纳士是澳洲八大里唯一一所大学的商学院同时获得了AACSB（国际精英商学院协会）、EQUIS（欧洲质量发展认证体系）和AMBA（国际工商管理硕士协会）三项商科国际认证。毕业生就业率排名全球前1%。</p><p>除QS专业世界前50的学校外，澳洲还有很多会计优势的大学：</p><p>麦考瑞大学 Macquarie University （悉尼）</p><p>优势：QS专业世界排名前100，毕业可考CPA注册会计师；CPA 办公室就在学校，方便考会计证。</p><p>迪肯大学 Deakin University（墨尔本）</p><p>优势：QS专业世界排名前150，CPA 办公室就在学校，方便考会计证；提供职业年课程。</p><p>塔斯马尼亚大学 University of Tasmania（塔斯马尼亚）</p><p>优势：百年名校，有1/4奖学金和移民的偏远地区加分。</p><p>南澳大学 University of South Austrailia （南澳大利亚州）</p><p>优势：当地规模最大，州政府投入力度最大，企业关系最紧密；有移民的偏远地区加分，有职业年课程。</p><p>就业方向：</p><p>注册会计师(税务、咨询、审计)、公司会计、公司秘书、管理咨询、政府部门工作(税务、审计、财政、地方政府)、财务规划、投资顾问、金融机构(银行、财务公司等)。</p><p>Art &amp; Design</p><p>艺术设计类</p><p>澳大利亚丰富的移民文化、多元文化特色及艺术氛围使得其艺术设计作品更具现代感和亚洲感,如果你来到澳大利亚,会被各种大胆的设计风格所吸引。澳大利亚的艺术院校在课程设置、授课方式和教学理念等方面都很有特点，尤其注重培养和开拓学生的创造性思维。</p><p>根据最新的QS世界大学【专业】排名显示，共有一所澳洲学校进入榜单前20，八所澳洲学校进入榜单前50。</p><p>具体榜单如下：</p><p><img src=""http://p3.pstatp.com/large/1dc100003d18c7ad9abb"" img_width=""580"" img_height=""554"" alt=""精华收藏帖：2017年澳大利亚名校优势专业排名"" inline=""0""></p><p>QS专业世界排名：RMIT大学17，墨尔本大学28，悉尼科技大学29，新南威尔士大学33，蒙纳士大学34，昆士兰科技大学41，悉尼大学42，澳洲国立大学48。</p><p>皇家墨尔本理工大学RMIT University（墨尔本）</p><p>优势：作为艺术设计的老牌院校，妥妥的拿到了澳洲第一名，世界排名此次为第17位。其传媒和设计专业排名高，专业细分，选择丰富。以服装设计为例，BOF (Business of Fashion) 时装商业评论曾发布“2015年度全球时装教育院校排行榜(Global Fashion Schools Ranking 2015)”，RMIT是澳洲唯一一所跻身全球时装学院前10的学校；与RMIT合作的各大时装品牌：Alexander McQueen, Calvin Klein International, Dior, Louis Vuitton, Vivienne Westwood, CountryRoad, Sportsgirl。毕业生可成为服装设计师、造型师、时尚界记者或者自创服装品牌。</p><p>蒙纳士大学 Monash University（墨尔本）</p><p>优势：蒙纳士艺术，设计&amp;建筑学院MONASH ART DESIGN &amp; ARCHITECTURE（MADA）享誉全球。MADA集合了屡获殊荣的艺术家，设计师和建筑设计师，为澳大利亚和全球社会与未来，共同创造一个美好的设计师社区。MADA的毕业生，一部分正在创建并运营全球最具革新与创意的设计工作室，另一大部分受雇于全球顶尖品牌，更有许多毕业生赢得了众多国家与国际大奖，获得了巨大的认可。</p><p>除世界前50的学校外，澳洲还有很多艺术设计优势的大学：</p><p>斯威本科技大学 Swinburne University of Technology（墨尔本）</p><p>优势：QS专业世界排名前100，澳洲设计师协会所在地。斯威本影视专业深受好评， 休斯顿国际电影节创建人和主席Hunter Todd曾盛赞：“斯威本是世界上最好的电影/视频制作学校。”</p><p>堪培拉大学 University of Canberra（堪培拉）</p><p>优势：QS专业世界排名前200，传媒专业综合优势强。</p><p>默多克大学 Murdoch university（西澳珀斯）</p><p>优势：新闻电视专业排名高、课程实用。</p><p>艾迪斯柯文大学 Edith Cowan University（西澳珀斯）</p><p>优势：和默多克大学齐名，拥有西澳珀斯地区最具实力的传媒专业。</p><p>昆士兰科技大学 Queensland University of Technology（布里斯班）</p><p>优势：有澳洲最大的创意产业基地。</p><p>格里菲斯大学 Griffith Univeristy（布里斯班、黄金海岸）</p><p>优势：在音乐艺术传媒领域排名名列前茅。</p><p>迪肯大学 Deakin University（墨尔本）</p><p>优势：传媒排名靠前，维多利亚州满意度及毕业生雇主满意度最高的大学。</p><p>麦考瑞大学 Macquarie University（悉尼）</p><p>优势：传媒艺术学院前身为澳大利亚电影电视广播学院，历史悠久，师资雄厚。</p><p>悉尼科技大学 University of Technology Sydney（悉尼）</p><p>优势：传媒专业全澳第一，专业综合优势强。</p><p>就业方向：</p><p>设计师、媒体工作人员如记者、编辑等、影视制作人员如剪辑、摄像、导演、动画师等。</p><p>Computer Science &amp; Information Systems</p><p>计算机/IT类</p><p>澳洲IT教育高质领先，学生在完成IT硕士课程后一般都能获得业界较高级别的认证；同时，澳洲IT专业的毕业生的就业前景非常可观，可以技术移民，该职业的发展势头迅猛。</p><p>根据最新的QS世界大学【专业】排名显示，共有一所澳洲学校进入榜单前20，四所澳洲学校进入榜单前50。</p><p>具体榜单如下：</p><p><img src=""http://p3.pstatp.com/large/1dbe00031e046c5e000e"" img_width=""577"" img_height=""277"" alt=""精华收藏帖：2017年澳大利亚名校优势专业排名"" inline=""0""></p><p>QS专业世界排名：</p><p>墨尔本大学14，澳洲国立大学36，新南威尔士大学42，悉尼大学43。</p><p>墨尔本大学 The University of Melbourne（墨尔本）</p><p>优势：计算机、工科专业世界闻名。</p><p>新南威尔士大学 The University of New South Wales (UNSW Australia)（悉尼）</p><p>优势：计算机、工程专业全澳排名前列。</p><p>除世界前50的学校外，澳洲还有很多计算机/IT优势的大学：</p><p>蒙纳士大学 Monash University（墨尔本）</p><p>优势：QS专业世界排名前100，享誉世界的密集研究型大学，是澳大利亚五星级大学。工程/技术与计算机科学领域在2012年和2013年都稳居世界第51-75名。</p><p>皇家墨尔本理工大学RMIT University（墨尔本）</p><p>优势：QS专业世界排名前100，其计算机和信息技术专业一直在澳大利亚处于领先地位，并且与业界巨头有着密切的联系，其中就包括谷歌、微软等巨头互联网公司。</p><p>伍伦贡/卧龙岗大学 Univeristy of Wollongong（新州伍伦贡市）</p><p>优势：计算机专业闻名。</p><p>就业方向：</p><p>软件工程师、计算机网络工程师等。</p><p>Law</p><p>法律类</p><p>澳洲历史上的绝大多数政府总理都是法律背景出身，作为澳大利亚可移民专业，法律专业的优势还是很多的，另外就业前景也非常被看好。</p><p>根据最新的QS世界大学【专业】排名显示，共有四所澳洲学校进入榜单前20，七所澳洲大学进入前50。</p><p>具体榜单如下：</p><p><img src=""http://p3.pstatp.com/large/1dc40000485e10057687"" img_width=""577"" img_height=""488"" alt=""精华收藏帖：2017年澳大利亚名校优势专业排名"" inline=""0""></p><p>QS专业世界排名：墨尔本大学11，悉尼大学13，新南威尔士大学14，澳洲国立大学16，蒙纳士大学27，悉尼科技大学43，昆士兰大学48。</p><p>除世界前50的学校外，澳洲还有很多法律优势的大学：</p><p>邦德大学 Bond Univeristy（黄金海岸）</p><p>优势：Juris Doctor (JD) 法律硕士课程是全澳唯一毕业后可获律师执照的课程——“The Juris Doctor is an approved degree for the purposes of admission as a legal practitioner in all Australian jurisdictions, in conjunction with further study (Graduate Diploma in Legal Practice) or a traineeship”。</p><p>堪培拉大学 Univeristy of Canberra（堪培拉）</p><p>优势：有自己的模拟法庭。</p><p>默多克大学 Murdoch University（西澳珀斯）</p><p>优势：法律专业知名。</p><p>就业方向：</p><p>律师、公检法系统、公司企业法务人员、大学老师等。</p><p>Architecture / Built Environment</p><p>建筑设计类</p><p>澳洲的建筑设计是闻名于世界的。作为澳大利亚可移民专业，其就业前景也很好。</p><p>根据最新的QS世界大学【专业】排名显示，共有两所澳洲学校进入榜单前20，六所澳洲大学进入前50。</p><p>具体榜单如下：</p><p><img src=""http://p3.pstatp.com/large/1dc500031c95f21eaa43"" img_width=""575"" img_height=""413"" alt=""精华收藏帖：2017年澳大利亚名校优势专业排名"" inline=""0""></p><p>QS专业世界排名：悉尼大学14，墨尔本大学19，新南威尔士大学22，RMIT大学28，纽卡斯尔大学45，昆士兰大学49。</p><p>悉尼大学The University of Sydney（悉尼）优势：悉尼大学建筑系成立于1919年，到1990年，建筑系正式确立建筑、规划与艺术设计三大学科和领域,并在建筑学系拥有细致的专业划分—包括建筑、设计、建筑物维护、灯彩照明设计、城市设计规划、设备维护管理、电子艺术、声学与声音以及古迹保护等等。</p><p>墨尔本大学The University of Melbourne（墨尔本）</p><p>优势：建筑园林设计专业全澳前3，课程着重在建筑学设计和实践，学习内容有助于建筑环境改善的设计技能、关于建筑学历史、理论、技术的基础内容，这些内容能够使毕业生具备开发关于时空、人文的创新建筑。</p><p>新南威尔士大学The University of New South Wales (UNSW Australia)（悉尼）</p><p>优势：专业全澳前3，学校曾参与悉尼奥运整体规划，提供的硕士课程包括城市发展与设计、环境建设可持续性发展、建筑管理和房地产等，是澳大利亚最大的建筑学院。</p><p>皇家墨尔本理工大学RMIT University（墨尔本）</p><p>优势：专业全澳前5。在2014年国际设计生活杂志Jebiga将RMIT列入世界顶尖建筑学校，与哈佛、麻省理工和英国AA建筑学院齐名。RMIT建筑与设计学院在美国、欧洲、亚洲都拥有广泛的行业合作伙伴，包括法国及日本的全球建筑研讨会，以及与哥本哈根、柏林、洛杉机、奥地林因斯布鲁克、上海、法国等地区的工作室项目。RMIT的建筑学院有着先进的教学理念，完善的教育设施，合理的课程安排以及强大的教育师资。</p><p>除世界前50的学校外，澳洲还有很多建筑设计优势的大学：</p><p>南澳大学 University of South Australia（阿德莱德）</p><p>优势：人才辈出，校友的设计曾中标悉尼奥运，北京奥运，丽泽金融区规划方案。</p><p>堪培拉大学 Univeristy of Canberra（堪培拉）</p><p>优势：专业被澳洲评为五星专业。</p><p>昆士兰科技大学 Queensland of Univeristy Technology（昆士兰）</p><p>优势：专业排名靠前。</p><p>就业方向：</p><p>建筑公司、房地产开发商设计师、制图师、工程技术和设计管理经理等。</p><p>Engineering and Technology</p><p>工程类</p><p>工程专业是相对容易移民的专业，雅思只需G类4个6,即可通过澳大利亚工程师协会（EA）的职业评估。工程师的方向很多，常见的有土木工程、机械工程、电气工程等等，需要逻辑推理、系统分析以及复杂问题的解决能力。工程类毕业生的就业前景相当可观，平均起薪点通常可以达到5万到6万澳元左右，一般工程师的入职起薪点是4.5万澳元，资深工程师的薪金可达到15到20万澳元以上。矿业工程的收入甚至更加可观，从6万澳元开始。</p><p>根据最新的QS世界大学【专业】排名显示，共有五所澳洲大学进入前50。</p><p>具体榜单如下：</p><p><img src=""http://p1.pstatp.com/large/1dbe00031e055552175d"" img_width=""577"" img_height=""347"" alt=""精华收藏帖：2017年澳大利亚名校优势专业排名"" inline=""0""></p><p>QS专业世界排名：墨尔本大学28，新南威尔士大学31，悉尼大学22，RMIT大学41，蒙纳士大学44，澳洲国立大学49。</p><p>皇家墨尔本理工大学 RMIT（墨尔本）</p><p>优势：澳洲汽车工业的摇篮，汽车工业基础所在地。</p><p>蒙纳士大学 Monash University（墨尔本）</p><p>优势：师资科研力量雄厚。</p><p>除世界前50的学校外，澳洲还有很多工程优势的大学：</p><p>斯威本科技大学 Swinburne University of Tehchnology（墨尔本）</p><p>优势：课程注重实践，毕业生就业率高。</p><p>就业方向：</p><p>各大制造业企业或者政府机构的各类工程师，如土木工程师、机械工程师、电气工程师等。</p><p>Pharmacy &amp; Pharmacology</p><p>药学类</p><p>药剂师目前是澳大利亚的紧缺职业，在CSOL列表内，每年约有1200名学生从药剂学专业毕业。药剂学毕业生第一年起薪并不高，主要在注册药剂师的指导下实习；但在第一年实习结束参加药剂师考试通过后，工资马上翻1倍，涨到6万澳元以上。</p><p>根据最新的QS世界大学【专业】排名显示，共有两所澳洲学校进入榜单前20，四所澳洲大学进入前50。</p><p>具体榜单如下：</p><p><img src=""http://p9.pstatp.com/large/1dc80000474b3c0e3e83"" img_width=""577"" img_height=""275"" alt=""精华收藏帖：2017年澳大利亚名校优势专业排名"" inline=""0""></p><p>QS专业世界排名：蒙纳士大学2，悉尼大学20，昆士兰大学31，墨尔本大学49。</p><p>蒙纳士大学 Monash University（墨尔本）</p><p>优势：专业排名全澳第1，全球第2，称霸全澳，亦在全世界享有盛誉。</p><p>悉尼大学The University of Sydney（悉尼）优势：专业排名全澳第2，全球第20。</p><p>除世界前50的学校外，澳洲还有很多药学优势的大学：</p><p>迪肯大学 Deakin University（墨尔本）</p><p>优势：课程实用，毕业生雇主评价高。</p><p>就业方向：</p><p>医药研究员、医院药剂师、制药企业的药品质量监督员等。</p><p>“</p><p>另附各医药类相关专业：</p><p>Medicine</p><p>医学类</p><p>根据最新的QS世界大学【专业】排名显示，共有两所澳洲学校进入榜单前20，五所澳洲大学进入前50。</p><p>具体榜单如下：</p><p><img src=""http://p1.pstatp.com/large/1dc80000474ca2145bb0"" img_width=""580"" img_height=""347"" alt=""精华收藏帖：2017年澳大利亚名校优势专业排名"" inline=""0""></p><p>QS专业世界排名：悉尼大学15，墨尔本大学19，蒙纳士大学29，昆士兰大学42，新南威尔士大学50。</p><p>Nursing</p><p>护理学</p><p>移民热门专业，小编力荐。</p><p>根据最新的QS世界大学【专业】排名显示，共有四所澳洲学校进入榜单前20，十所澳洲大学进入前50。</p><p>具体榜单如下：</p><p><img src=""http://p3.pstatp.com/large/1dbe00031e07749baf60"" img_width=""580"" img_height=""688"" alt=""精华收藏帖：2017年澳大利亚名校优势专业排名"" inline=""0""></p><p>QS专业世界排名：悉尼科技大学4，悉尼大学9，蒙纳士大学12，墨尔本大学18，迪肯大学24，阿德莱德大学33，格里菲斯大学34，昆士兰大学38，昆士兰科技大学42，南澳大学48。</p><p>护理课程介绍：</p><p>称霸移民世界，唯有Nursing护理专业【全面解析护理专业+常见问题汇总】</p><p>Education</p><p>教育类</p><p>教育专业是澳大利亚移民专业之一，澳洲当地的教师需求量非常大，且随着西方国家汉语热的兴起，拥有中英双语能力的教学专业的毕业生具有很大的竞争力。澳洲的教师一般分为三个类别，early childhood学前教育，primary小学教育和secondary中学教育。教师的工资起薪也是比较高的，而且每年新毕业生的起薪都会有一定增长。澳洲学校在教育学专业表现出色，墨尔本大学甚至进入了全球前五，仅次于伦敦大学学院，哈佛大学，斯坦福大学和剑桥大学。</p><p>根据最新的QS世界大学【专业】排名显示，共有四所澳洲学校进入榜单前20，八所澳洲大学进入前50。</p><p>具体榜单如下：</p><p><img src=""http://p3.pstatp.com/large/1dbe00031e0618ea0542"" img_width=""578"" img_height=""551"" alt=""精华收藏帖：2017年澳大利亚名校优势专业排名"" inline=""0""></p><p>QS专业世界排名：墨尔本大学5，悉尼大学11，昆士兰大学14，蒙纳士大学17，迪肯大学28，澳洲国立大学39，昆士兰大学45，新南威尔士大学49。</p><p>除世界前50的学校外，澳洲还有很多教育优势的大学：</p><p>皇家墨尔本理工大学 RMIT（墨尔本）</p><p>优势：全澳只有RMIT提供一年制（含实习）的Graduate Diploma in Education (Early Childhood)，成为很多想通过补课走教育移民学生的捷径。</p><p>就业方向：</p><p>在国家教育或社会福利部门从事初级教育、教育行政、福利事业、教育咨询与指导等工作；在早期儿童服务中心任教，例如学龄前学校、看护中心以及幼儿园等。</p><p><strong>指南针原创文章 严禁抄袭转载 </strong></p><br>","悉尼大学澳洲国立大学墨尔本大学莫纳什大学UNSW"
"一个人一生中最重要的能力是什么｜英语每天学","上海图书馆","2017-05-03 11:59:14","<p><img src=""http://p1.pstatp.com/large/18b20004f819de8531e6"" img_width=""650"" img_height=""139"" alt=""一个人一生中最重要的能力是什么｜英语每天学"" inline=""0""></p><blockquote><p>上海图书馆每天为头条号的读者提供优质的双语阅读文章</p></blockquote><h1>聚焦一生中最重要的技能</h1><p>1. The ability to express your thoughts<strong>表达自己想法的能力</strong></p><p>It’s extremely important for a person to learn to put into words, what he thinks. It makes a relationship last. It gives you a chance to explore what others think about your ideas. It lets you answer questions in a way other people understand.</p><p><strong>对于一个人来说，学着用语言来表达自己的想法是非常重要的。这能让一段关系维持下去，给你一个机会去探索别人对你的想法所抱有的看法，让你以其他人能够明白的方式回答问题。</strong></p><p><img src=""http://p1.pstatp.com/large/1dc1000039670efe1f46"" img_width=""640"" img_height=""426"" alt=""一个人一生中最重要的能力是什么｜英语每天学"" inline=""0""></p><p>2. The ability to tell a good story <strong>讲好故事的能力</strong></p><p>You are going to meet a lot of people in a lifetime and while you’ll forget most of them, you’ll always remember the good storytellers.</p><p><strong>你会在一生中遇到许多人，但是你会忘记他们之中的大部分，却会一直记住那些会讲故事的人。</strong></p><p><img src=""http://p3.pstatp.com/large/1dc400004552c22361ce"" img_width=""640"" img_height=""423"" alt=""一个人一生中最重要的能力是什么｜英语每天学"" inline=""0""></p><p>3. Self-discipline<strong>自律</strong></p><p>The skill is to motivate oneself constantly and to never lose track of one’s goals and to work constantly towards them.</p><p><strong>这种技能就是不停地激励自我、永远不会迷失自己的目标并且不停地朝着目标努力。</strong></p><p><img src=""http://p3.pstatp.com/large/1dc5000319a54f2d17b3"" img_width=""600"" img_height=""366"" alt=""一个人一生中最重要的能力是什么｜英语每天学"" inline=""0""></p><p>4. The ability to accept<strong>接受的能力</strong></p><p>Accept that life can’t always be the way you want. Accept that you can’t keep everyone happy. Accept that unrealistic goals can never be achieved. Accept that you can’t change things which are not in your hands. Accept that your happiness lies in your hands. If we accept these, life will be much simpler.</p><p><strong>接受不能尽如人意的生活。接受你无法取悦每一个人。接受不切实际的目标永远无法实现。接受你无法改变不为你掌握的事情。接受你的幸福掌握在你自己手中。如果我们能接受这些，生活将会简单得多。</strong></p><p><img src=""http://p1.pstatp.com/large/1dbe00031b64d70eaa47"" img_width=""330"" img_height=""220"" alt=""一个人一生中最重要的能力是什么｜英语每天学"" inline=""0""></p><hr><blockquote><p>获得更好的英语阅读体验</p><p>请关注上海图书馆信使</p><p>Wechat ID：shlibrary</p></blockquote>","英语鸡汤教育"
"司法考试每日一练：商经法（5.3）","正保法律教育网","2017-05-03 12:05:11","<p>法律教育网司法考试《每日一练》包括网校精编题目测试和历年真题测试两大部分，注册学员登录后系统记录做题结果，方便您随时查看在线测试记录，让您的复习备考更科学有效。每天进步一点点，提高一分，干掉千人！</p><p>【多选题】</p><p>张、王、李、赵各出资四分之一，设立通程酒吧（普通合伙企业）合伙协议未约定合伙期限。现围绕合伙份额转让、酒吧管理等事项，经全体合伙人同意，林某被聘任为酒吧经营管理人，在其受聘期间自主决定采取的下列管理措施符合《合伙企业法》规定的是（ ）</p><p>A.为改变经营结构扩大影响力，将经营范围扩展至法国红酒代理销售业务</p><p>B.为改变资金流量不足情况，以酒吧不动产为抵押，向某银行借款50万元</p><p>C.为营造气氛，以酒吧名义与某音乐师签约，约定音乐师每晚在酒吧表演2小时</p><p>D.为整顿员工工作纪律，开除2名经常被顾客投诉的员工，招聘3名新员工</p><p>【正确答案】 CD</p><p>【答案解析】 选项A错误。《合伙企业法》第三十一条第（二）项规定，除合伙协议另有约定外，改变合伙企业的经营范围、主要经营场所的地点，应当经全体合伙人一致同意。</p><p>选项B错误。《合伙企业法》第三十一条第（三）项规定，除合伙协议另有约定外，处分合伙企业的不动产，应当经全体合伙人一致同意。</p><p>选项C.D中的事项不属于《合伙企业法》中规定的需要经全体合伙人一致同意才能进行的事项。因此，经营管理人在其受聘期间可以自主决定采取。</p><p><strong>法律教育网原创，转载请注明出处</strong></p>","国家司法考试法律法国葡萄酒教育"
