"标题","作者","时间","正文","标签"
"纯艺｜这么有Bigger的专业你真的不读？","艺术留学作品集","2017-05-03 11:46:24","<p>大家好</p><p>我叫MoreART艺诺国际教育</p><p>我不是留学中介</p><p>也不是语言培训机构</p><p>我就是我</p><p>一个假正经，真高端的</p><p>艺术留学作品集培训学校</p><p><strong>说到艺术留学，必然要提到纯艺。</strong></p><p>可能对于一部分刚开始学艺术设计的学生和不太理解的家长来说，会觉得纯艺不就是基础课程么，又无聊又枯燥，有什么值得学的呢？更何况是花上两年时间去学。</p><p>其实很多来MoreART咨询的朋友最开始也是这样想的，觉得纯艺就是基础课程，只要学的差不多就好了，而且毕业以后就业面很窄，可选择的公司机构实在太少了。</p><p><img src=""http://p9.pstatp.com/large/1dbe000312779b5d4d9b"" img_width=""640"" img_height=""442"" alt=""纯艺｜这么有Bigger的专业你真的不读？"" inline=""0""></p><p>可能大家会有这样的想法，也是受到传统固有思想的影响，认为纯艺是让人摸不着头脑的专业，学纯艺的学生看起来都高深莫测的。很多人对学纯艺的人第一印象就是潇洒不羁，或有点神经质的落魄青年。甚至有人说，学纯艺的人作品要到艺术家去世之后才会值钱。小More对于这些想法可是大大的不赞同！</p><p><img src=""http://p3.pstatp.com/large/1dc400003ce2817686c0"" img_width=""640"" img_height=""427"" alt=""纯艺｜这么有Bigger的专业你真的不读？"" inline=""0""></p><p>小More今天就要和大家来好好说说纯艺专业啦~其实纯艺才不是谣传的那样呢！我们纯艺可是最有bigger的专业~</p><p>纯艺其实一个概念很宽泛的专业，就艺术发展到目前而言，纯艺早已不局限于绘画的范围内了，只要是能通过视觉媒介呈现出来的、与造型有关的专业我们都可以将其纳入纯艺的范畴。所以~那些说纯艺就业方向窄的朋友~哼哼！</p><p><img src=""http://p3.pstatp.com/large/1dca0003111de9a8356f"" img_width=""640"" img_height=""484"" alt=""纯艺｜这么有Bigger的专业你真的不读？"" inline=""0""></p><p>纯艺一直是一个比较小众的专业，且在艺术留学中竞争非常激烈。可能很多同学看到“竞争激烈”就有点打退堂鼓了，但小More个人认为纯艺其实是一个非常棒的专业。</p><p>纯艺的就业方向包括画廊、美术馆、艺术中心、拍卖行、画院、艺术研究所、线上交易平台。并且由于纯艺专业毕业之后，专业基础非常强悍，所以想转行其他领域也都是非常简单易上手的，像广告公司、出版社、教育培训机构这些行业都可以选择。</p><p><img src=""http://p3.pstatp.com/large/1dc50003114875920971"" img_width=""640"" img_height=""920"" alt=""纯艺｜这么有Bigger的专业你真的不读？"" inline=""0""></p><p>一般来说，纯艺专业可以分为两个方向：视觉艺术与非视觉艺术。</p><p>视觉艺术涵盖了我们最常见的绘画（插画、油画）、雕塑、陶瓷、影像、装置等。</p><p>非视觉艺术则是指戏剧、写作、唱歌等形式。</p><p>这里我们主要讲的是视觉艺术方向的纯艺~</p><p><img src=""http://p3.pstatp.com/large/1dc5000311453bd72d18"" img_width=""640"" img_height=""448"" alt=""纯艺｜这么有Bigger的专业你真的不读？"" inline=""0""></p><p>国内的纯艺专业其实还比较偏向于传统学院派的，所谓传统学院派，正如其字面意思所示，主要还是遵循着题材规范、技巧规范和艺术语言规范的创作法则，其中以油画为创作媒介的创作方式又占了主要比例。国内院校更多的关注点都集中于技艺上，而非艺术本身。</p><p>但在国外，学院明显都会更注重创作媒介的突破，对于这类艺术而言，就不仅仅局限于技术层面的水平了，而是加入了更多艺术家本人的思想内容。</p><p><img src=""http://p3.pstatp.com/large/1dc5000311490afc1c82"" img_width=""550"" img_height=""752"" alt=""纯艺｜这么有Bigger的专业你真的不读？"" inline=""0""></p><p>在作品点评或课程教学方面，国内老师更多的会直接告诉学生哪些方面需要改善，哪些方面如何能更好地表现。但国外的老师则更注重学生的思维发散，他们不会直接告诉学生如何达成最优效果。他们会向学生展示更多的作品，用作品来引导学生，让学生摸索到最好的艺术表现形式。</p><p>可能很多人会有疑问，这样光看不讲解有什么用呢，其实这就是中国学生比国外学生欠缺的了，不止是艺术专业，相信其他专业也是如此，中国学生更习惯于这种”填鸭式“的教学方式，这样的教学方式虽然直观快捷，但对于学生来说，其实压抑了他们自己的思考能力，闭塞了学生的想象力，这对于艺术设计类学生来说可是”致命“的。</p><p>在这样新颖的教学方式下，可能最开始同学们会很迷茫，不知所措，但是过一段时间后，你就会发现自己不知不觉中已经有了自己的艺术创作风格与作品表达方式。我们常说，思想是自由的，艺术作为思想表达的一种方式，也应该是自由的。所以千万不要只局限于技艺的提高啦~</p><p><img src=""http://p3.pstatp.com/large/1dca00031120a7b0b720"" img_width=""640"" img_height=""881"" alt=""纯艺｜这么有Bigger的专业你真的不读？"" inline=""0""></p><p>下面小More再来和大家安利几个纯艺非常棒的学校吧~</p><p><strong>罗德岛设计学院 </strong></p><p>学校纯艺类专业有：版画、陶艺、插画、玻璃、摄影、油画、雕塑</p><p><strong>作品集</strong></p><p>包含12—20件最能够代表申请人近期能力的艺术作品。（作品最好能完整的反映出申请人在艺术方面的思想、兴趣、经历和能力）接受任何形式的作品提交，作品集通过Slide Room上传，需要付10美元费用。</p><p>除作品集外还需要完成学校命题的附加任务</p><p><strong> 芝加哥艺术学院 </strong></p><p>4年制，可选择专业有：纯艺术专业（侧重理论研究）、摄影、艺术教育、陶艺、油画与素描等</p><p><strong>作品集</strong></p><p>需提交15张图片作品，或总计不超过20分钟的媒体作品（合作完成的需注明个人工作内容）可以DVD、16mm电影、SD/HDmini-DV、CD-R、闪存盘或其他苹果兼容的媒介。</p><p>除作品外，还需提供一份纸质打印版作品名称列表（包括作品名称、大小规格、时常、作品时间等）。</p><p>（艺术教育专业的学生需提交能代表自己最高能力的作品，可包括学术论文，在校艺术教育项目等，除作品外还需提交两份500—1000字的个人陈述。内容包括对于艺术的个人理解、艺术工作经验、对教育的理解、艺术成就等；以及对职业目标的陈述。）</p><p><strong>马里兰艺术学院 </strong></p><p>该学校纯艺类可选择专业有：制陶、绘画素描、插画、油画、摄影、版画复制、大众艺术（研究生）</p><p><strong>作品集</strong></p><p>学校作品集对于每个专业都不太一样，本科要求较低，需提交12—20张能展示申请者兴趣特长的作品图片，通过Slideroom提交即可。</p><p>研究生要求较高，需提交18—20幅图片（jpg/pdf格式），网络上传，需注明标题、信息、媒介、维度等信息。</p><p>其中插画实践（研究生）还需提交学校出题的文字作品</p><p><strong> 耶鲁大学 </strong></p><p>学校可选择的纯艺类专业有：艺术（本科）、油画和版画、摄影、雕塑</p><p><strong>作品集</strong></p><p>本科：提交5—8幅作品，其中至少包含一副绘画作品。</p><p>研究生：大部分作品最好是提交前12个月内创作完成的，时间最久的作品也必须是在3年以内创作的，其中必须有一张代表作。</p><p>看完了学校，小More最后要和大家分享一些作品啦~希望大家能学习到新的创作思路~</p><p><strong>艺术家 Charistian Barthord</strong></p><p><img src=""http://p3.pstatp.com/large/1dbe0003127a5fb0bad0"" img_width=""596"" img_height=""762"" alt=""纯艺｜这么有Bigger的专业你真的不读？"" inline=""0""></p><p><img src=""http://p3.pstatp.com/large/1dbe0003127d233dc076"" img_width=""600"" img_height=""760"" alt=""纯艺｜这么有Bigger的专业你真的不读？"" inline=""0""></p><p><strong>艺术家 Piotr Lesniak</strong></p><p><img src=""http://p3.pstatp.com/large/1dca0003111f562e6f23"" img_width=""640"" img_height=""886"" alt=""纯艺｜这么有Bigger的专业你真的不读？"" inline=""0""></p><p><img src=""http://p3.pstatp.com/large/1dc1000031a97bc4f98d"" img_width=""640"" img_height=""876"" alt=""纯艺｜这么有Bigger的专业你真的不读？"" inline=""0""></p><p><strong>艺术家 Aida Liz Casallas</strong></p><p><img src=""http://p3.pstatp.com/large/1f7b0000357e9ff45683"" img_width=""640"" img_height=""360"" alt=""纯艺｜这么有Bigger的专业你真的不读？"" inline=""0""></p><p><img src=""http://p3.pstatp.com/large/1dc400003ce847234e72"" img_width=""640"" img_height=""360"" alt=""纯艺｜这么有Bigger的专业你真的不读？"" inline=""0""></p><p><strong>艺术家 Frank Plant</strong></p><p><img src=""http://p3.pstatp.com/large/1f7b0000357f40a0469b"" img_width=""640"" img_height=""427"" alt=""纯艺｜这么有Bigger的专业你真的不读？"" inline=""0""></p><p><img src=""http://p3.pstatp.com/large/1dc800003bc702f30ac3"" img_width=""640"" img_height=""427"" alt=""纯艺｜这么有Bigger的专业你真的不读？"" inline=""0""></p><p><strong>艺术家 Gosia Herba</strong></p><p><img src=""http://p1.pstatp.com/large/1dbe0003127e7c218711"" img_width=""640"" img_height=""896"" alt=""纯艺｜这么有Bigger的专业你真的不读？"" inline=""0""></p><p><img src=""http://p1.pstatp.com/large/1dc5000311543861bd4b"" img_width=""640"" img_height=""896"" alt=""纯艺｜这么有Bigger的专业你真的不读？"" inline=""0""></p><p>好啦，今天小More就和大家分享这么多啦~</p><p>咨询艺术留学作品集相关内容一定要给小More留言哦~</p><p>会第一时间回复大家的</p><p>and</p><p>大家有好的意见或建议也请不要吝啬的告诉小More</p><p>和大家比心~</p>","艺术美术版画雕塑插画"
"二本院校里的优势专业及未来10大前景看好的职业方向，值得研究","志愿研究徐生伟","2017-05-03 11:44:05","<p>徐生伟</p><p>选择什么专业，是很多高中生纠结的事。有数据显示，很多大学生进入大学之后后悔选错专业，这个比例还不低。每年都会跟很多高三家长交流这个问题，说法不一，无非两个方面，一个觉得专业最重要，优先考虑；一个是觉得院校比较关键，优先考虑，并且各说都还有道理。相信关注教育的人或者面临需要选择的人一定有自己的想法。</p><p>虽然现在也有很多种声音，大学在淡化专业界限，按专业大类招生、可以辅修其他专业甚至可以转专业，等等，这些都体现出了对大学专业政策的放宽，确实是值得参考，但是比例很有限。并且值得注意的是淡化专业界限的学校往往都是比较好的重点本科院校，普通本科院校及高职专科院校对专业的要求还是很高，因此笔者给大家的建议就是：一本包括重点本科选学校，二本及以下选专业，主要有两个原因：其一，层次越高的重点本科院校享受国家的政策、资讯都是最好的，接收的信息面也是最宽的，大家知道现在是信息时代。其二，重点本科生未来途径可选空间大，考研、出国等都有优势，那么二本及以下选择一个好的专业对未来就业就是最大的帮助，提高就业竞争力是关键。</p><p><img src=""http://p1.pstatp.com/large/1f7b000030608c59b666"" img_width=""1307"" img_height=""753"" alt=""二本院校里的优势专业及未来10大前景看好的职业方向，值得研究"" inline=""0""></p><p>关于大学专业方向研究前面也专门发表过一篇文章聊过，不多说，这里就二本院校里面比较好的专业及未来10大比较看好的职业方向跟大家分享下。</p><p>一、部分二本院校里的优势专业</p><p>1990年以前，中国部委直属高校一共有368所。随着国家“211工程”的实施，大学分化重组，有215所高校划给地方，归省市（区）直属，其中的大部分进入了“一本”，少部分成为了“二本”。这些二本院校，由于投入早，办学久，底子厚，基础扎实，在某个专业领域里有很强的实力。部分名单如下：</p><table class=""border""><tbody><tr class=""firstRow""><td>现在的名称</td><td>现直属的省市（区）</td><td>原来的名称</td><td>原直属的中央部委</td><td>优势专业</td></tr><tr><td>天津工业大学</td><td>天津</td><td>天津纺织工学院</td><td>纺织部</td><td>纺织工程、服装设计、材料科学与工程</td></tr><tr><td>西安工程大学</td><td>陕西</td><td>西北纺织工学院</td><td>纺织部</td><td>纺织工程、轻化工程、服装设计与工程</td></tr><tr><td>浙江理工大学</td><td>浙江</td><td>浙江丝绸工学院</td><td>纺织部</td><td>纺织工程、动画、服装设计与工程</td></tr><tr><td>石家庄经济学院</td><td>河北</td><td>河北地质学院</td><td>地质部</td><td>资源勘查工程、工商管理、土地资源管理</td></tr><tr><td>成都理工大学</td><td>四川</td><td>成都地质学院</td><td>地质部</td><td>地质学、地球物理学、资源勘查工程</td></tr><tr><td>长春理工大学</td><td>吉林</td><td>长春光学精密机械学院</td><td>中国兵器总公司</td><td>光信息科学与技术、机械设计制造及其自动化</td></tr><tr><td>南昌工程学院</td><td>江西</td><td>南昌水利水电高等专科学校</td><td>水利部</td><td>水利水电工程、土木工程、水土保持与荒漠化防治</td></tr><tr><td>青岛科技大学</td><td>山东</td><td>青岛化工学院</td><td>化工部</td><td>高分子材料与工程、化学工程与工艺、应用化学</td></tr><tr><td>武汉工程大学</td><td>湖北</td><td>武汉化工学院</td><td>化工部</td><td>化学工程与工艺、制药工程、材料科学与工程</td></tr><tr><td>西安科技大学</td><td>陕西</td><td>西安矿业学院</td><td>煤炭部</td><td>采矿工程、测绘工程、安全技术及工程</td></tr></tbody></table><table class=""border""><tbody><tr class=""firstRow""><td>河南理工大学</td><td>河南</td><td>焦作矿业学院</td><td>煤炭部</td><td>采矿工程、安全工程、电气工程及其自动化</td></tr><tr><td>安徽理工大学</td><td>安徽</td><td>淮南矿业学院</td><td>煤炭部</td><td>采矿工程、土木工程、地质工程</td></tr><tr><td>安徽工业大学</td><td>安徽</td><td>马鞍山钢铁学院</td><td>冶金部</td><td>冶金工程、化学工程与工艺、热能与动力工程</td></tr><tr><td>北方工业大学</td><td>北京</td><td>北京冶金机电学院</td><td>中国有色金属总公司</td><td>电子信息工程、机械设计制造及其自动化</td></tr><tr><td>江西理工大学</td><td>江西</td><td>南方冶金学院</td><td>中国有色金属总公司</td><td>采矿工程、冶金工程、材料工程</td></tr><tr><td>西安理工大学</td><td>陕西</td><td>陕西机械学院</td><td>机械部</td><td>机械设计制造及其自动化、水利水电工程</td></tr><tr><td>河南科技大学（合并）</td><td>河南</td><td>洛阳农机学院</td><td>机械部</td><td>车辆工程、材料成型及控制、计算机科学与技术</td></tr><tr><td>太原科技大学</td><td>山西</td><td>太原重型机械学院</td><td>机械部</td><td>材料成型及控制、自动化、机械设计制造及其自动化</td></tr><tr><td>长沙理工大学（合并）</td><td>湖南</td><td>长沙交通学院</td><td>交通部</td><td>交通运输、土木工程、水利水电工程</td></tr><tr><td>天津科技大学</td><td>天津</td><td>天津轻工业学院</td><td>轻工部</td><td>生物工程、包装工程、食品科学与工程</td></tr><tr><td>大连交通大学</td><td>辽宁</td><td>大连铁道学院</td><td>铁道部</td><td>车辆工程、材料成型及控制工程、焊接技术与工程</td></tr><tr><td>兰州交通大学</td><td>甘肃</td><td>兰州铁道学院</td><td>铁道部</td><td>车辆工程、自动化、交通运输、土木工程</td></tr><tr><td>成都信息工程学院</td><td>四川</td><td>成都气象学院</td><td>中国中央气象局</td><td>气象学、电子科学与技术、雷电防护科学与技术</td></tr><tr><td>南华大学（合并）</td><td>湖南</td><td>中南工学院</td><td>中国核工业总公司</td><td>核工程与核技术、预防医学、矿物资源工程</td></tr><tr><td>东华理工大学</td><td>江西</td><td>华东地质学院</td><td>中国核工业总公司</td><td>核物理工程、资源勘查工程、水文与水资源工程</td></tr><tr><td>湖南工业大学</td><td>湖南</td><td>株州工学院</td><td>中国包装总公司</td><td>包装工程、印刷工程、艺术设计</td></tr><tr><td>江苏科技大学</td><td>江苏</td><td>镇江船舶学院</td><td>中国船舶总公司</td><td>船舶与海洋工程、信息管理与信息系统</td></tr><tr><td>长江大学（合并）</td><td>湖北</td><td>江汉石油学院</td><td>石油部</td><td>资源勘查技术与工程、农学、石油工程</td></tr><tr><td>三峡大学（合并）</td><td>湖北</td><td>葛州坝水利电力学院</td><td>水利电力部</td><td>水利水电工程、灾害与环境工程、电气工程及其自动化</td></tr></tbody></table><p>二、未来10大职业方向看好的专业。这里需要补充说明的是，我一直不认为某个专业就一直是热门或者冷门，正如之前说过某些农业类专业虽然很多人不喜欢，但是很多学校分数还高的很，毕业出来之后在相关的科研所工作也是非常厉害的。以下列举的是代表一些比较看好的专业方向，比如物流业、旅游业，可供一定价值的参考。毕竟专业方向确定可考虑的具体因素还有很多，比如地域，喜好等等。</p><p>1、同声传译专业</p><p>同声传译员被称为“21世纪第一大紧缺人才”。随着中国对外经济交流的增多和中外合作的加深，需要越来越多的同声传译员。</p><p>2、理财规划师</p><p>据了解，美国理财规划师的平均年收入是11万美元，香港理财规划师最高收入达200多万港元，随着经济发展，理财的观念已经大众化，而如何更好的让自己的财富生出更多财富就是理财规划师存在的价值。</p><p>3、风控官</p><p>近几年来，互联网金融像个大火球滚火遍全国，但在赚钱同时，这个行业的风险也越来越大，这让风控官越来越抢手。</p><p>4、生物医药研发师</p><p>生物医药研发是国际公认的高投入、高风险、高附加值、高回报的高新技术产业，其核心研发人员无疑对专业性门槛的要求很高。医药行业一直是高薪行业，生物医药研发师尤为如此。</p><p>5、精算师</p><p>精算师是分析风险并量化其财务影响的专门职业人员，由保险公司雇用的数学专业人员，主要从事保险费、赔付准备金、分红、保险额、退休金、年金等的计算。</p><p>6、前端工程师</p><p>前端工程师，也就是所谓的前端Web开发人员，他们把程序员编制的一段又一段代码，变成了在网上看到的内容。</p><p>7、心理咨询师</p><p>我国心理咨询师行业仍处于起步阶段，是一个朝阳职业。教育、医疗、武警、监狱、残联、妇联、社区、企业等系统的专业心理咨询机构，都缺乏优秀的心理咨询师。心理咨询师是按小时收费的。</p><p>8、人力资源师</p><p>企业如何更好地“引才”“用才”“留才”成为决定企业成败的关键，而人力资源师正是该关口的掌舵人。</p><p>9、物流师</p><p>物流师是指具体从事供应、采购、运输、储存、产成品加工、包装和回收的安排，以及处理物流相关信息等物流行业工作的人员。经济的发展，对物流师的需求也越来越高。</p><p>10、旅游体验师</p><p>旅游体验师是网络环境下催生的一个旅游行业新兴职位，可以跟随旅行团免费游山玩水，通过网络将旅游文字、图片或视频实时与网友在线共享，并最终对该条旅行线路给出综合评价，以供网友参考。</p><p>欢迎大家提出不同的观点和对不同专业方向的认识，共同探讨交流。</p>","大学土木工程材料科学纺织服装设计"
"司法考试每日一练：理论法学（5.3）","正保法律教育网","2017-05-03 11:45:53","<p>法律教育网司法考试《每日一练》包括网校精编题目测试和历年真题测试两大部分，注册学员登录后系统记录做题结果，方便您随时查看在线测试记录，让您的复习备考更科学有效。每天进步一点点，提高一分，干掉千人！</p><p>【单选题】</p><p>张女穿行马路时遇车祸，致两颗门牙缺失。交警出具的责任认定书认定司机负全责。张女因无法与肇事司机达成赔偿协议，遂提起民事诉讼，认为司机虽赔偿3，000元安装假牙，但假牙影响接吻，故司机还应就她的“接吻权”受到损害予以赔偿。关于本案，下列哪一选项是正确的？（ ）</p><p>A.张女与司机不存在产生法律关系的法律事实</p><p>B.张女主张的“接吻权”属于法定权利</p><p>C.交警出具的责任认定书是非规范性法律文件，具有法律效力</p><p>D.司机赔偿3，000元是绝对义务的承担方式</p><p>【正确答案】 C</p><p>【答案解析】 综观本题，可以首先排除选项B，然后通过对三个概念的把握，逐一分析其他选项。</p><p>选项A错误。张女和司机之间因为司机的侵权行为而产生法律关系，所以，二人之间是存在产生法律关系的法律事实的。</p><p>选项C正确。规范性法律文件是在一般情况下，针对一般对象发布的能够反复适用和普遍适用的抽象的法律文件。非规范性法律文件是在特定情况下，针对特定对象发布的一次性适用的具体的法律文件。据此可知，交警出具的责任认定书是非规范性法律文件。</p><p>选项D错误。绝对义务对应不特定的权利人，相对义务对应特定的权利人。司机赔偿3，000元是相对义务的承担方式。</p><p><strong>法律教育网原创，转载请注明出处</strong></p>","国家司法考试法律交通法制教育"
"雅安市招考办成功举办雅安市2017年普通高校招生宣传咨询会","雅安新闻联播","2017-05-03 11:46:37",,"高考大学武汉大学西南财经大学上海交通大学"
"常用的旅游英语口语（在飞机上）","轻松学口语","2017-05-03 11:44:23","<p> 飞机，是最为便捷的交通方式。出去游玩，我们一般都会选择飞机出行。小编总结了一些在飞机上常用的英语口语。</p><p><img src=""http://p1.pstatp.com/large/1f7b000031b054f1f077"" img_width=""335"" img_height=""240"" alt=""常用的旅游英语口语（在飞机上）"" inline=""0""></p><p>1.Excuse me，miss. I don't know how to turn on the reading light.</p><p>对不起，小姐，我不知道如何开那只阅读用的灯。</p><p>2. Just press the switch on your arm rest.</p><p>您按一下扶手上的那个开关就行了。</p><p>3. By the way，Would you like a copy of the latest“TIME”?</p><p>顺便问一下，您是否要一本最新的《时代》杂志?</p><p>4. Could I stretch out on those two empty seats?</p><p>我可不可以躺在那两个空的座位上?</p><p>5. You're probably airsick，and I'll get some medicine for you right away.</p><p>您很可能晕机了，我马上去给您弄些药来。</p><p><img src=""http://p3.pstatp.com/large/1f7b00003272efba53da"" img_width=""448"" img_height=""240"" alt=""常用的旅游英语口语（在飞机上）"" inline=""0""></p><p>6. I've just realized I don't have my travelling bag.</p><p>我刚发觉我的旅行包不在身边。</p><p>7. I think I must have left it by your air-line counter at the airport.</p><p>我想我肯定把它忘在机场你们航空公司的柜台边上了。</p><p>8. Don't worry，sir. Can you tell me what it is like?</p><p>别急，先生，您能告诉我那只包是什么样子吗?</p><p>9. It is made of black leather， with my name and address on it.</p><p>它是黑色皮革制品，而且上面还有我的姓名和住址。</p><p>10. I really appreciate your help.</p><p>衷心感谢你的帮助。</p><p><img src=""http://p1.pstatp.com/large/1dc400003aff5f329c5b"" img_width=""320"" img_height=""240"" alt=""常用的旅游英语口语（在飞机上）"" inline=""0""></p><p>switch n. [电器]开关</p><p>airsick a. 晕机的</p><p>pillow n. 枕头</p><p>declaration n. 宣告，宣布</p><p>embarkation n. 乘坐飞机</p><p>disembarkation n. 登陆，上岸</p><p> 西岸英语举办的首届为荒漠添一票绿报名活动开始了，你可能会获得丰厚的活动奖品哦，赶紧报名吧！更多实用的内容，请关注我的微信公众号&lt;西岸英语&gt;。</p>","英语交通航空教育"
