"标题","作者","时间","正文","标签"
"临沂一中南校区2016级班主任这样对学生说","牧野尘缘","2017-05-03 11:57:24","<p>班主任是学校教育的具体组织者、实施者，教学工作的协调者，更是班集体的培育者。为了有效地促进班主任工作，分享工作中的点点滴滴，南校区2016级举行了五期班主任论坛。</p><h1>班主任这样说：</h1><p> 在班级管理中，我秉持自立、自信、自管、自主、自觉、自强的理念，引导学生把自己降到零点，踏实前行，同时相信自己是优秀的，从而把优秀当成一种习惯。在学生的自我管理中，引导学生去按规则、守规矩，按程序、找方法地高效做事，以期养成良好习惯，获得全面发展。我告诉学生，你们是优秀的，已经无需见证！我期望，你们是会思考的芦苇，有飞翔的冲动，就不要爬着！我们要把亲人的目送、询问、扶助留在心田，与同学结伴，与老师同行，徜徉浩瀚书海，行进在新的路上。</p><p>——高一、1班 王庆胜</p><p> 在班级管理中，班主任必须从改变学生和自身的思想认识开始，时刻要求自己公平公正的对待每一个学生，同时，放低自己的心态，尊重学生的正确选择，倾听学生的心灵之声，观察学生的言谈举止，谨言慎行的对待学生的错误，把学生当做一个平等的人、自己的家人来对待，不仅要再学习中给与指导，更要在生活中给与关怀和帮助。进步是双向的，学生的成长也意味着我作为班主任自身的成长，将学生培养成社会所需要的、有社会责任感的人，这是我长期为之不断奋斗的目标。</p><p>——高一、2班 吴 杨</p><p> “共同成长，感谢有你”。班级常规建设主要有班委的培养，小组合作制，值日班长制，小先生制。以“用心了解学生，全面了解学生”为基础进行班级建设。关注学生的心理问题，及时和家长沟通。总结工作中的不足之处，共同成长。起初因缘相聚，未来用心陪伴是对自己工作的一个期盼。</p><p>——高一、3班 史雪霖</p><p> 我的班级工作目标是：建设完善的班级制度，和蕴含教育力量的班级文化，做有人情味的班集体，过值得回味的高中生活。班级管理方面要人人有事做，事事有人做。班主任要注意去发现一些预见性的问题，要学会离场管理。班主任更要努力改变自我。</p><p>——高一、4班 刘青峰</p><p> 围绕 “用爱、用心建设班级”，主要分为两部分内容：“用爱教育”和“用心了解和建设”。用爱教育是贯穿整个过程的主线；用心了解主要从五方面进行：课上表现、平时出其不意、与任课老师沟通、与家长沟通、活动表现。用心建设班级主要从以下四方面做起：班级常规建设、推行值日班长制、建设自治班级、推动小组合作学习，从硬件到软件来用心建设班级。虽然过程中，有时会想要放弃，但是学生毕竟是孩子，需要我们用爱和用心去对待。</p><p>——高一、5班 邢庆媛</p><p> 听完董艳老师的班主任论坛发言，在佩服她语言表达能力强的同时，深深感到要多读书，多学习。从之前班主任论坛的交流中，我学会了“小先生制”并在班级推广，学生们收获非常大。根据自身的实际情况，我认为在班主任的“离场管理”中，选一个好的班长非常重要，同时，还要注意在班级树立规矩意识，在重要的关键时间点上，同样也要靠班。</p><p> ——高一、6班 张大鹏</p><p> 教育是需要期待的，它是一种固守，一种耐心，是一份信任和一份宽容！我很感性，经常为学生的行为而感动，经常为学生的成长而幸福。教育工作本就繁杂、琐屑、艰辛，班主任工作更是如此。但是，既然当了，就要承担，既然做了，就应努力做好——承担的前提，是让自己强大，做好的前提，是让自己不断成长：所谓成长，就是让自己变得更好，更值得学生亲近、喜欢与敬重。</p><p>——高一、7班 董 艳</p><p> 面对教学和班级管理，应当怎么做呢？第一要以“勤”字为先。做教学工作，不仅要勤于备课、上课，更要勤于抓课后落实。做班主任工作，更要勤抓班级管理。第二要以“严”字当头。一支军队要想有战斗力，首先要有严明的纪律。第三要注重细节。一些不起眼的小细节甚至会对班级管理工作起到决定性的作用，细节决定成败。第四要注重工作的方式方法。单纯的打压不仅不能解决问题，甚至会激起孩子的逆反心理。应该带着欣赏的眼光去看待孩子的问题，循序渐进，引导为主。我们要追求工作中的幸福，而幸福来源于学生，幸福来源于和谐的团队。</p><p>——高一、8班 侯 迪</p><p> 围绕 “在学习中成长”，主要从班级的各项制度建设和全面了解学生两个方面介绍。班级制度主要有小组合作制、小先生制、值日班长制以及定期评奖评优制度，对每项制度的形成以及实行的意义做了详细的介绍。通过日常观察、个别谈话以及与家长的交流沟通来实现全面了解学生，践行年级倡导的“不抛弃、不放弃、不放弃每一个学生”。</p><p> ——高一、9班 谢芳 </p><p> 班主任工作任重而道远，必须有宽厚博大的胸怀，细致入微的心理，远大时尚的眼光，紧紧抓住爱、勤、导三个要素，创造性地劳动，使学生在德、智、体、美、劳几方面全面发展，成为适应新时代的各种人才。班级工作中，只有勤于付出，实现价值，才能收获幸福与喜悦。在教育之路上，我们任重而道远。</p><p>——高一、10班 柏庆平</p><p><img src=""http://p3.pstatp.com/large/1dc400004268526ea827"" img_width=""900"" img_height=""600"" alt=""临沂一中南校区2016级班主任这样对学生说"" inline=""0""></p><p><img src=""http://p3.pstatp.com/large/1f7b00003ad1b656fb4d"" img_width=""900"" img_height=""600"" alt=""临沂一中南校区2016级班主任这样对学生说"" inline=""0""></p><p><img src=""http://p1.pstatp.com/large/1dbe000317a043474a8c"" img_width=""900"" img_height=""600"" alt=""临沂一中南校区2016级班主任这样对学生说"" inline=""0""></p><p>雨果说：“世界上最广阔的是海洋，比海洋更广阔的是天空，比天空更广阔的是人的灵魂。”教师是塑造人类灵魂的工程师，而班主任是战斗在这一阵地最前沿的战士，是一班之魂。此次班主任论坛的成功举行，让班主任、副班主任老师受到了极大的熏陶和感染，取长补短，并结合自己的实际探索适合自己班级管理的新路子，从而使教育工作更加有利于学生的成长。</p>","张大鹏教育"
"鸣山中心小学来鹤湖学校参观交流","九江新闻网","2017-05-03 12:00:00",,"教育"
"商洛全面推进中小学校责任督学挂牌督导创新县工作","陕西省教育厅","2017-05-03 12:09:29",,"教育"
"山东扩大普通本科高校综合评价招生试点有十所高校","水母网","2017-05-03 11:48:03",,"高考大学浙江大学升学考试教育"
"《光明日报》刊登我校党委书记葛世伦地方高校“新工科”建设访谈","盐城工学院","2017-05-03 11:54:45","<p><span>地方高校“新工科”建设如何革旧出新</span></p><p>——访盐城工学院党委书记葛世伦</p><p>“新工科”近来成为教育界关注的热点话题和我国高等工程教育改革的方向，其建设发展需要工科优势高校、综合性高校和地方高校三方共同发力，其中，地方高校最重要的职责在于为区域经济发展和产业转型升级提供支撑。按理说，这是地方高校长期以来坚持的办学定位，那么“新工科”建设要解决什么“旧”问题，又如何“出新”？记者日前采访了盐城工学院党委书记葛世伦。</p><p>“‘新工科’的‘新’就是要培养主动适应新技术、新产业、新经济发展的卓越工程科技人才。”葛世伦告诉记者，伴随高等工程教育改革，学校长期以来探索出的卓越工程人才培养新路径与“新工科”建设思路不谋而合，现在可以说是进一步延续和深化。</p><p>首先，“专业的对接要做到因时而动”，就是问地方产业需求建专业。2005年，盐城工学院针对盐城制造业向中、高端发展，依靠建材类学科专业优势，在机制类专业设置制造业数字化、模具设计方向，2011年起，面向盐城汽车、环保、海洋等战略性新兴产业建设，新增能源与动力工程、物联网工程、海洋科学、新能源材料与器件等20个新专业。</p><p>其次，“企业的对接要做到积极开放”，就是重视引入市场化力量推进产教融合。学校将盐城的汽车、环保等产业领域多家企业汇聚起来，先后创立了一系列学院，如与江苏悦达集团联合成立盐城悦达汽车学院，与盐城国家级环保科技城合作共建盐城环保卓越学院等。在这些学院，学校和企业共同审定人才培养方案、合作编写教材，企业常年提供顶岗实习“预就业”岗位，参与学生评价考核。</p><p>最后，“知和行的对接要做到真正落地”，就是注重提高学生工程实践和创新能力。学校要求工科实践课时比例增加到总学时的35%。实施企业学业“双导师”制，学业老师被派到企业参与技术改造、项目设计和产品研发，提升实践创新能力，优秀的企业工程技术人员则聘为兼职教师，走进课堂为学生上课。“课堂与工作的无缝对接，使学生练就了解决实际问题的本领，也逐渐培养出一种企业家精神。”据统计，盐城环保企业的老板，很多都毕业于该校，毕业生在地方就业的比率逐年攀升。</p><p>我国拥有世界上最大规模的工程教育，工科在校生约占高等教育在校生总数的三分之一，“新工科”建设事关未来工程教育人才培养质量，相关院校将大有作为。葛世伦坦言，作为地方工科院校，充分发挥工程教育在师资队伍、实践平台、行业协同等方面的优势，更大程度地实现学校与地方经济社会发展的“同频共振”，应当成为自身的价值取向和目标定位。</p><p>（本报记者 郑晋鸣）</p><p>http://epaper.gmw.cn/gmrb/html/2017-05/03/nw.D110000gmrb_20170503_7-06.htm?from=singlemessage&amp;isappinstalled=0</p><p>中国青年网：http://news.youth.cn/jsxw/201705/t20170503_9646137.htm</p><p>中国社会科学网：http://www.cssn.cn/jyx/jyx_xzljy/201705/t20170503_3506091.shtml</p><p>中工网：http://edu.workercn.cn/196/201705/03/170503084437577.shtml</p><p>搜狐网：http://www.sohu.com/a/137880985_115423</p><p><img src=""http://p3.pstatp.com/large/1dbe000318c21e1a38aa"" img_width=""1022"" img_height=""696"" alt=""《光明日报》刊登我校党委书记葛世伦地方高校“新工科”建设访谈"" inline=""0""></p>","大学环境保护能源HTML经济"
"全国初中英语教师教学 基本功大赛举行 哈市113中张艳宇荣获一等奖","东北网","2017-05-03 11:48:00",,"吴娜升学考试教育"
"遵义桐梓：十三名中小学老师被评为省级骨干教师","娄山关","2017-05-03 11:54:53","<p>根据《省教育厅办公室关于对省级骨干教师进行考核认定的通知》（黔教办函〔2016〕124号）精神，对“十五”、“十一五”期间认定的中小学省级骨干教师进行考核。经过省教育厅组织专家组的考核</p><p>桐梓这13个老师</p><p>最终确定为贵州省中小学省级骨干教师</p><p>赶紧来看看名单</p><p>↓↓↓</p><p><span>姚鸿章——桐梓县坡渡镇中心学校办公室</span></p><p>谢均燕——娄山关镇中心学校</p><p>娄小明——桐梓县第四中学</p><p>杨信刚——第五中学</p><p>杨兴满——桐梓县教育局</p><p>温兴辅——桐梓县新站镇中心学校</p><p>张 鹏——桐梓县思源实验学校</p><p>王佳秋——娄山关镇中心学校</p><p>江君龙——桐梓县第二高级中学</p><p>王开芳——娄山关镇逸夫小学</p><p>犹明绪——桐梓一中</p><p>于天智——桐梓县第四中学</p><p>文代铭——桐梓县教育局教研室</p><p>这些优秀的人民教师</p><p>兢兢业业、脚踏实地</p><p>用一支粉笔担起祖国的教育事业重任</p><p>为他们点ZAN！！</p>","升学考试教育"
"活久见！苏州园区招聘：园区公安分局招聘50名特勤类警辅","苏州华图教育","2017-05-04 09:23:43","<p>苏州工业园区公安分局根据《苏州市警务辅助人员管理办法》和《苏州工业园区警务辅助人员分类管理办法》，现面向社会公开招录公安特勤类警务辅助人员50名(男性)，特制定本简章。</p><p><img src=""http://p3.pstatp.com/large/1dca0004f76bd13fb49c"" img_width=""427"" img_height=""320"" alt=""活久见！苏州园区招聘：园区公安分局招聘50名特勤类警辅"" inline=""0""></p><p><strong>一、岗位说明</strong></p><p>公安特勤由苏州工业园区公安分局巡特警大队负责管理，主要职责为协助公安机关负责园区社会面巡防工作和安保工作等。</p><p><strong>二、报考要求</strong></p><p>1、具有较高的政治素质和较强的事业责任性，自愿从事公安特勤工作，纪律观念强，自觉服从分配，中共党员优先。</p><p>2、苏州大市户籍，男性，年龄在18周岁至30周岁(1986年5月至1999年5月期间出生);具有高中(含中专或职高)及以上学历。对外省市户籍的人员，只招录复退军人和具有专业特长的人员。</p><p>3、身体健康，体貌端正，机警敏捷无传染性疾病，双眼单裸视力(标准对数视力)达4.8(含)以上，身高为1.75米(含)以上。</p><p>4、符合园区公安机关规定的其他录用条件。</p><p>5、有下列情形之一的，不得报考：</p><p>(1)受过公安机关行政处罚的，或有违法犯罪前科的;</p><p>(2)有犯罪嫌疑尚未查清的;</p><p>(3)曾被单位辞退或开除的;</p><p>(4)道德败坏，有不良行为和纹身的;</p><p>(5)对直系血亲、旁系血亲被判处刑罚自己有看法的;</p><p>(6)其他不宜录用的情形。</p><p><strong>三、报名程序和录用方法</strong></p><p>报名者需本人到场并提供以下材料：报名表(附件一下载)、身份证、户口簿、毕业证书、退役证(退复军人提供)及两张两寸彩色照片;各相关材料均需交验原件并交复印件一份。</p><p>符合报名条件的人员给予登记。根据报名情况，适时通知体能测试、笔试、面试、体检(体检费自理)、政审。请报考人员保持通讯工具畅通。</p><p><strong>四、工资待遇</strong></p><p>公安特勤(警务辅助人员)一律实行公益性岗位制度，薪酬待遇由园区管委会财政保障，净收入年薪6.5万元(不含个人交纳的公积金部分);免费提供食宿，单位缴纳五险一金(养老、医疗、工伤、失业、生育、住房公积金)，并享受国家和苏州市政府规定的社会保险。</p><p><strong>五、纪律与监督</strong></p><p>招录实行自律制度，即报考者要对自己所提交信息的真实性负责，凡发现弄虚作假和违反考试录用纪律的报考人员，一律取消考试或录用资格。</p><p><strong>六、报名时间和报名地点</strong></p><p>报名时间：2017年5月2日—5月10日，上午9：00--11：00，下午13：30--16：30(双休日除外);</p><p>报名地点：苏州工业园区唯新路119号苏州工业园区公安分局巡特警大队二楼内勤办公室;</p><p>咨询服务联系电话： 0512—67588217、0512-66601621。</p><p><strong>七、本简章由苏州工业园区公安分局负责解释</strong></p><p>附件：园区公安分局2017年招录警务辅助人员报名表</p><p>原文阅读：http://suzhou.huatu.com/zhaojing/1122045.html</p>","法律体检社会"
"女大学生做主播挣钱怀疑读书何用？上大学只为发财买房吗？","原创","杨不易","<p>前两天，看到一条新闻，说一些女大学生在直播平台做视频直播，网友动不动打赏。其中一位，还在大学期间，就自己买了房。以至于有做视频直播的女大学生对人生产生了怀疑：上大学到底有什么意义？</p><p><img src=""http://p9.pstatp.com/large/1dc00006215ad35cdaad"" img_width=""700"" img_height=""469"" alt=""女大学生做主播挣钱怀疑读书何用？上大学只为发财买房吗？"" inline=""0""></p><p>这句话，问得很有意思，引发颇多思考。</p><p>在中国，从古至今，读书都是改变命运的主要途径之一。古时候，你通过读者，考上了举人、进士或者状元，就能做官，改变自己的人生，同时也光宗耀宗。前些年，一些普通老百姓子女，尤其是农村子弟，通过读书考上大学，就算跳出农门，彻底告别面朝黄土背朝天的生活。上大学，可以说多少人梦想中的大好事，改变命运吧！很励志！</p><p>正因为如此，直到现在，很多人上大学，仍然期望着能够过上人上人的生活。如此过上这样的生活呢？不外是有权，或者有钱。所以，理所当然地认为，上了大学就能比其他人挣更多的钱，过更好的生活。</p><p><img src=""http://p3.pstatp.com/large/1dc500029db45d5775bd"" img_width=""1200"" img_height=""800"" alt=""女大学生做主播挣钱怀疑读书何用？上大学只为发财买房吗？"" inline=""0""></p><p>显然，这种想法是错误。随着社会环境的改变，挣钱的途径就太多了。特别是近几天，很多新兴的产业出来后，根本不需要太多的书本知识，只要脑子够灵光，搭上了车，很快就能挣钱，而且挣得不少。比如做视频直播这事儿，就是这样。互联网浪潮一波接一波，谁能赶上潮头，还真说不准。再说了，挣钱这事儿，本身跟读多少书没太大关系。很多挣钱多的人，只读了很少的书。</p><p>但是，这不能说读书无用。或者说，要去怀疑上大学的意义。一般而言，上大学有两个方面的意义，第一当然是学到一门专业知识，为将来的生存储备必要的能力；第二，却是内心修养和人生阅历的必要。一个人的气质和内涵的养成，很大的一部分都是在大学期间完成的。这些，对一个人的一生来说，可能比挣到多少钱更重要。</p><p>直白地说，挣钱，你可以有很多种方式，除了当白领，做公司高管，或者做官员、富二代，甚至做小生意玩直播等等，都可以挣到足够生活的钱，甚至发财。我家楼下那个摆摊卖烧烤的，也买了好几套房。但气质和内涵的养成，以及上大学这一人生阅历，却是通过其他方式完成不了的。</p><p><img src=""http://p3.pstatp.com/large/1dc2000624f6ac38f148"" img_width=""2048"" img_height=""1536"" alt=""女大学生做主播挣钱怀疑读书何用？上大学只为发财买房吗？"" inline=""0""></p><p>上过大学的人，大概都很怀念那一段时光。20岁左右的阳光年龄，在大学校园里的幸福时光，简简单单地念书、运动，或者小小地恋爱一场。而出来工作后，才觉得生活如此苦逼和太多压力。所以，大学时光，几乎是一个人进入社会之前最美好的三四年时间，是非常值得珍惜的。</p><p>都说青春无悔，不管你将来的工作，与上大学有没有关系，无论你将来发了多大的财，都不要后悔这一段时光，更不要怀疑它的意义。</p>","大学购房邓等等鸡汤教育"
