"标题","作者","时间","正文","标签"
"我的泰语翻译之路，学着跟泰语死磕（连载日记）","小罗带你游泰国","2017-05-03 11:50:25","<p><strong>写在前篇:</strong></p><p> 最美的风景在路上！在我的家乡美丽的东湖边写下我的泰语翻译之路，学着跟泰语死磕引言，并由此开始我的泰语翻译之路！在此开篇记录每天学习泰语的过程及心得体会，包括泰语学习的知识要点，难点以及分享自己的学习经验及小技巧。如果你有更好的学习经验或者不认同我的一些学习方法，再或者难免有弄错的地方，请大家海涵！</p><p><img src=""http://p3.pstatp.com/large/1dbe000313f698010ff3"" img_width=""454"" img_height=""321"" alt=""我的泰语翻译之路，学着跟泰语死磕（连载日记）"" inline=""0""></p><p class=""pgc-img-caption"">学习蜗牛的持之以恒精神，慢不要紧，我们最终会到达目的地</p><p>为了生活，我们可以去学习泰语；为了梦想，我们可以去学泰语；我想对于目前的我来说，应该两者兼之吧。语言是人与人之间沟通的桥梁，很多人学习语言，究其原因可归纳为三点，一是兴趣爱好使然，天性中有着对语言的敏感及热爱，这种人多半心思细腻，甘愿做一片衬托的绿叶，并享受翻译的过程。这种情况学习泰语，只要有名师稍加点拨，很轻松的就可以在翻译市场咱露头角，很羡慕这样的人群！二是对这个国家的文化，明星、影视剧感兴趣的粉丝们；三是高考失利调剂专业或者家人逼着去读一门自己不喜欢的专业，这种人可以说运气不好，一辈子从事不喜欢的事情，即使在这个工作岗位上兢兢业业，一生的事业上也不会有大的起色，因为缺少了“热爱”两个字，一切无从谈起，即使花再多的时间去努力学习，也很难达到这个行业理想的高度。很庆幸在三十多岁的年纪，我还能醒悟，不想自己年老那一天，为年轻时的不够努力，为年轻时毅然投入自己最喜爱的翻译事业而老泪纵横。现在不管如何，已经没有退路。不管你处于上面哪种情形，跟我一起，拿出你的热情，疯狂学习泰语，学着跟泰语死磕！</p><p>已经不完全记得当年为什么会选择走泰语翻译这条路，目前唯一能想起来可能是工作的关系吧，那一年在旅行社国内部上班，挨着出境部的同事们，整天听到的是各种关于泰国的旅游宣传，或许从那个时候开始关注泰国，开始关注泰语，泰国是一个全国百分之九十七的民众信仰佛教的国家，民众普遍生活态度乐观，热情祥和，也有自己信佛的原因吧。泰国还是一个慢悠悠的国度，自己性格也很喜欢这样的慢节奏。总之，各种机缘，让你跟泰语有缘！！！</p><p>男怕入错行，女怕嫁错郎！我可能属于上面归类第三个，高中懵懂得去学习了美术，一个至今都很不愿意谈及的话题，实在是不够的热爱，三年的坚持，换来的是极度自卑。后面的学习可想而知，只能边混边不情愿的读完大学，当时读大学也想调剂专业，那个时候读大学不好调剂专业，努力过一次，跟家人野沟通过，最后就放弃了，混着读完了大学。这一放弃，后面的生活也是一落千丈，事业没起色，何谈生活！这一放弃的代价太大，如今已经是两个孩子的父亲，每天卖小菜撑起全部家庭生活的母亲，自己还没有足够的能力去承担一个男人应尽的责任！这点实在惭愧，愧对家人！</p><p>在工作的前几年，为了弥补高中大学留下来的遗憾，曾边工作边尝试去学习了法语，韩语，不过每次都浅尝辄止，母亲对我以后从事泰语翻译的决心有点不敢相信。当时想法很简单，没选择读英语专业，一定要再学习一门语言做翻译。英语专业普及率太高，也出于对未来就业的思路考虑，去选择学习小语种。学习小语种一定也要热爱这个国家的一切，选择泰语是缘分，自己很喜欢泰语这个国度，坚持学习几个月以来，坚信自己的选择一定没错。好！就泰语了！死磕泰语！</p><p>有时总觉得选择自己喜欢的，可能自己会做的更好吧，不让自己的人生留有遗憾，不努力一次怎么知道会不会实现人生逆转呢？满怀对家人的亏欠，自私的讲，也为了自己，因为自己觉得如果选择自己喜欢的，我会做的更好！我会更努力，更有能力的去创造一个家庭生活所必备的物质基础。</p><p>与其去纠结你要花多少钱，报什么班，不如先自我审视一下你的动力是什么。学习小语种兴趣很重要，兴趣可以支撑你以最大的热情投入，泰语里面的元音，辅音，声调，复合元音，清浊辅音，前引字，复合辅音等基础知识需要，跟我们小时候学习汉语一样，最基本的声母、韵母，数字，组成一个一个字，组成一个一个词，最后组成一段一段的句子。</p><p>在这里推荐基础1到基础4的进阶系统学习，从基础到高级，线上一些泰语课程主要以基础泰语1，2为主，基础1是最基础的元音、辅音，声调等，再加上简单的课文，句型，词汇。基础2则是以课文为主，训练学习者的听说读写，如今网络的普及，泰语网络资源一抓一大把，各种平台，比如yy，微博，微信公众号，贴吧，包括现在的百家号，今日头条号搜索泰语都会有相关的泰语资源供你学习，前提只要你想学！不管免费还是付费，你都可以根据自己的经济能力及需求来选择，学习资源最重要靠自己，自学能力强的人，可以找免费网络资源学习，自学能力稍差，可以加入泰语某个群或者组织，互相监督，一起学习，不懂的问题也可以多交流，总之，学习语言贵在持之以恒，不懂就问，不能懒惰！终有一天，你会发现自己泰语学习会有很大的进步！</p><p><img src=""http://p1.pstatp.com/large/1f7b000037039b6112d0"" img_width=""580"" img_height=""435"" alt=""我的泰语翻译之路，学着跟泰语死磕（连载日记）"" inline=""0""></p><p class=""pgc-img-caption"">泰语基础１到基础４教程</p><p>很羡慕一些在校的学生们有大把的时间可以去学习，如果正好是泰语专业的学生，更可以如鱼得水，光凭教学的师资力量，学习泰语的氛围等这些都是自学泰语的爱好者无法比拟的，所以自学的人，要更加的刻苦努力，抓住每一分每一秒，你只有比泰语专业的学生更愿意投入时间，才能学好泰语，更何况你以后还要成为一个以泰语翻译为职业的人儿。</p><p>我的泰语翻译之路还处在起步阶段，只是想跟泰语学习者或以后成为泰翻的朋友分享自己的学习历程，学习经验也不够翻译大家们的精辟深刻，所以在泰语学习的认知上有不足之处，希望各位朋友们给予中肯的建议。</p><p>后面的文章会以日记的形式出现，记录一下每天学习泰语的过程以及学习心得，以后如果你也跟我一样立志成为一个泰翻，请关注泰语luo知乎专栏，随时关注我的最新日记，记录有学习过程，也有个人生活心得体会，一起努力加油！！！</p><p>今天先写到这吧，东湖边上的风吹的凉嗖嗖的，我要撤了，以东湖美美的湖景来做结尾，明天待续！<img src=""http://p9.pstatp.com/large/1dc10000334b4ab268e9"" img_width=""790"" img_height=""590"" alt=""我的泰语翻译之路，学着跟泰语死磕（连载日记）"" inline=""0""></p><p class=""pgc-img-caption"">美丽的家乡东湖边<br></p>","大学文章经济欢聚时代泰国"
"西邮在全国软件和信息技术专业人才大赛电子类省赛中再获佳绩","西安邮电大学","2017-05-03 11:45:53","<p>日前，第八届“蓝桥杯”全国软件和信息技术专业人才大赛电子类省赛成绩揭晓，我校代表队荣获一等奖8项、二等项6项、三等奖10项。</p><p>本次大赛分为单片机设计与开发和嵌入式设计与开发2个项目。获得一等奖的选手将代表陕西赛区参加今年5月下旬在北京举行的全国总决赛。比赛旨在培养高等院校学生的自主创新意识和工程实践能力，激发大学生在电子信息领域的学习与研究兴趣，推动高等院校电子与信息类课程体系和教学内容的改革，为行业输送具有创新能力和系统设计能力的高端人才及具有熟练职业技能的实践型人才。 </p><p>据悉，4月8日，由工业和信息化部人才交流中心主办，我校承办的第八届“蓝桥杯”全国软件和信息技术专业人才大赛电子类省赛在电子工程学院大楼举行，来自西安邮电大学、空军工程大学、西安理工大学、西安工业大学、西安建筑科技大学、西安科技大学、陕西科技大学、西安工程大学等25所高校的385支队伍参赛。</p><hr><p>运营人员：张金磊</p><hr>","大学软件空军工程大学升学考试教育"
"名师讲堂 来自哈佛耶鲁孩子妈的一份邀请函","无锡好易校园通","2017-05-03 11:47:36","<blockquote><p>养育孩子是要选择中式还是西式？</p><p>是要放养还是要管束？</p><p>是要快乐教育？</p><p>还是也需要一些痛苦教育？</p><p>你对孩子的教育存在困惑吗？</p><p>你能很好地与孩子沟通吗？</p><p><strong>在我们盛情邀请之下，</strong></p><p><strong>刚接受过央视电台《阳光芳草地》采访，</strong></p><p><strong>哈佛耶鲁的神奇妈妈蒋小宁，</strong></p><p><strong>将前来无锡</strong><strong>免费现场授课</strong><strong>！</strong></p></blockquote><p><img src=""http://p3.pstatp.com/large/1dc400003d3d9d7d27f6"" img_width=""300"" img_height=""169"" alt=""名师讲堂 来自哈佛耶鲁孩子妈的一份邀请函"" inline=""0""></p><p>话不多说，赶紧来看看见面会详情吧！</p><p><strong>↓↓↓↓↓↓</strong></p><p><strong>蒋小宁见面会详情介绍</strong><strong>1</strong> </p><p>见面会时间：<span>2017年5月7日晚19:00</span></p><p><span>见面会地点：</span><span>无锡市国金中心19楼，太湖广场钟书路99号（博物馆对面，图书馆东）</span></p><p>报名方式：<span>发送 </span><strong>姓名+手机号码+学生年级 </strong><span>至公众号后台即可，</span><strong>名额仅限50个</strong><span>，先到先得，报满即止。</span></p><p><img src=""http://p1.pstatp.com/large/1dc40000310aebb8e643"" img_width=""412"" img_height=""268"" alt=""名师讲堂 来自哈佛耶鲁孩子妈的一份邀请函"" inline=""0""></p><p><strong>最后强调一下：</strong><strong>活动免费</strong><strong>！你还不来！？</strong></p><p><strong>蒋小宁老师介绍</strong></p><p><img src=""http://p1.pstatp.com/large/1f7b000029cfd211447d"" img_width=""534"" img_height=""393"" alt=""名师讲堂 来自哈佛耶鲁孩子妈的一份邀请函"" inline=""0""></p><p> 蒋小宁老师早年毕业于南京大学，通过在中国从小学到研究生长达二十余年的学习经历，对中国教育有着切肤的深刻体会。1989年，蒋小宁携子赴美，在美国亲历了两个孩子二十多年的家庭教育，洞悉了美国教育的方方面面。在养育孩子的道路上，她博采中西教育之长，通过宽严结合、指教与引导并济的家教方法，取得了令人瞩目的教育成果。</p><p><img src=""http://p9.pstatp.com/large/1dc100002609cf03c033"" img_width=""639"" img_height=""888"" alt=""名师讲堂 来自哈佛耶鲁孩子妈的一份邀请函"" inline=""0""></p><p> 在美国西雅图的华人圈，蒋小宁是一位非常出名的妈妈。十年前，她的大儿子同时被美国麻省理工学院、哈佛大学、斯坦福大学和杜克大学录取；十年后，小儿子又接到耶鲁大学等数所世界顶级名校的录取通知。这位温婉的东方妈妈，究竟会什么样的魔法，能在十年间将两个儿子都送进世界顶级名校并保持优秀？</p><p><img src=""http://p3.pstatp.com/large/1dbe000306f66d7ded96"" img_width=""637"" img_height=""886"" alt=""名师讲堂 来自哈佛耶鲁孩子妈的一份邀请函"" inline=""0""></p><p> 作为一名职场妈妈，蒋小宁平时并没有把过多精力放在督促孩子的学习上，而始终以“优秀”为培养目标，大胆放手让孩子追逐属于他们自己的梦。她最深刻的育儿体会是优秀不是天生的，而是可以培养出来的。作为一名在养育孩子上颇有建树的妈妈，蒋小宁二十余年的教养智慧正在北美华人圈以及中国大陆生根发芽，启迪着越来越多的妈妈成为更好的妈妈。</p><p><img src=""http://p3.pstatp.com/large/1dc8000038fa45b7b6d4"" img_width=""440"" img_height=""199"" alt=""名师讲堂 来自哈佛耶鲁孩子妈的一份邀请函"" inline=""0""></p><p>更多锡城教育资讯，敬请关注无锡好易校园通（WXHOOYXYT）</p>","耶鲁大学哈佛大学职场妈妈麻省理工学院美国"
"山西地区太原博纳沃德培训学校考试全部通过！","木偶人","2017-05-03 11:44:38","<h1>你关心的 才是头条</h1><h1>添加关注获取实时资讯</h1><hr><p><img src=""http://p3.pstatp.com/large/1dc100002a8008d65834"" img_width=""450"" img_height=""140"" alt=""山西地区太原博纳沃德培训学校考试全部通过！"" inline=""0""></p><p><strong>特大喜讯！</strong></p><p><strong>特大喜讯！</strong></p><p><strong>特大喜讯！</strong></p><p><strong>2017年4月17日全国企业教练师统考成绩已公布。</strong></p><p><strong>山西地区</strong><strong>【太原博</strong><strong>纳沃德培训学校】考试全部通过！</strong></p><p><img src=""http://p3.pstatp.com/large/1dc40000367e38a43a33"" img_width=""640"" img_height=""426"" alt=""山西地区太原博纳沃德培训学校考试全部通过！"" inline=""0""></p><p><img src=""http://p1.pstatp.com/large/1dbe00030c3c952812dc"" img_width=""1280"" img_height=""960"" alt=""山西地区太原博纳沃德培训学校考试全部通过！"" inline=""0""></p><p><strong>企业教练师高级考试通过名单：</strong></p><p><strong>李冬梅</strong></p><p><strong>高辉峰</strong></p><p><strong>赵志芳</strong></p><p><strong>宋佩淇</strong></p><p><strong>孟彩媚</strong></p><p><strong>李 飞</strong></p><p><img src=""http://p1.pstatp.com/large/1f7b00002f73e01b1b92"" img_width=""1280"" img_height=""960"" alt=""山西地区太原博纳沃德培训学校考试全部通过！"" inline=""0""></p><p><strong>企业教练师中级考试通过名单：</strong></p><p><strong>张 瑞 崔春燕</strong></p><p><strong>耿 彪 张国强</strong></p><p><strong>孙 嘉 李 强</strong></p><p><strong>陈朝晖 任晓斌</strong></p><p><strong>王 颖 吕 洋</strong></p><p><strong>高 雁 刘明通</strong></p><p><strong>侯红红 韩佳佳</strong></p><p><strong>郭 雷 王 敏</strong></p><p><strong>张 众 董玉星</strong></p><p><strong>冯永宏 郝卫东</strong></p><p><strong>李雪东 曹建章</strong></p><p><img src=""http://p3.pstatp.com/large/1dca00030b74d0351354"" img_width=""1280"" img_height=""960"" alt=""山西地区太原博纳沃德培训学校考试全部通过！"" inline=""0""></p><p><strong>企业教练师初级考试通过名单：</strong></p><p><strong>焦志云 张 勇 安晓瑾</strong></p><p><strong>封宏亮 王琅琅 张 健</strong></p><p><strong>王风琴 杨 洁 李 波</strong></p><p><strong>赵 凯 刘 堃 张力军</strong></p><p><strong>温美琴 陈晓娟 徐建军 </strong></p><p><strong>卫晓东 戎泽梅 王丽平</strong></p><p><strong>白 雪 孙哲明 宫利忠</strong></p><p><strong>刘亚东 赵迎红 黄美琳</strong></p><p><strong>檀翠广 李海峰 张海燕 </strong></p><p><strong>张 垚 梁卫国 楼立峰</strong></p><p><strong>李晓娟 任永斌 景海峰 </strong></p><p><strong>田建宏 郭小霞 梁计花</strong></p><p><strong>张 军 张巧花 张 晋 </strong></p><p><strong>考试前平台建立了专属的考试复习群在群里和教练们一起互动复习</strong></p><p><strong>通过大家的共同努力，恭喜教练们都取得了优异的成绩，拿上了四海八荒梦寐以求的【教练师资格证</strong><strong>】！证书下达时间为30个工作日。</strong></p><p><strong>同时教练专属信用卡也会陆续发到大家的手中！</strong></p><p><img src=""http://p1.pstatp.com/large/1dc40000378b9f0fd0a9"" img_width=""960"" img_height=""1280"" alt=""山西地区太原博纳沃德培训学校考试全部通过！"" inline=""0""></p><p><img src=""http://p9.pstatp.com/large/1dc500030bd93bbaf311"" img_width=""1280"" img_height=""960"" alt=""山西地区太原博纳沃德培训学校考试全部通过！"" inline=""0""></p><p><img src=""http://p3.pstatp.com/large/1dc500030bf3cbc96722"" img_width=""960"" img_height=""1280"" alt=""山西地区太原博纳沃德培训学校考试全部通过！"" inline=""0""></p><p><img src=""http://p3.pstatp.com/large/1dc8000036cf42face58"" img_width=""1207"" img_height=""764"" alt=""山西地区太原博纳沃德培训学校考试全部通过！"" inline=""0""></p><p><img src=""http://p1.pstatp.com/large/1f7b0000306de250479d"" img_width=""350"" img_height=""350"" alt=""山西地区太原博纳沃德培训学校考试全部通过！"" inline=""0""></p><p><strong>博纳沃德热情欢迎可爱的教练们回来继续支持更多人成长！</strong></p><p><img src=""http://p3.pstatp.com/large/1dca00030cadee9b40aa"" img_width=""502"" img_height=""150"" alt=""山西地区太原博纳沃德培训学校考试全部通过！"" inline=""0""></p><p><strong>温馨提示：</strong></p><p><strong>△5月11日-5月14日：教练型领导课程第一阶段CT1-60开班</strong></p><p><strong>△5月12日-5月14日：教练型领导课程第三阶段TA57尾周末</strong></p><p><strong>△5月24日-5月28日：教练型领导课程第二阶段CT2-60开班</strong></p><p>运营人员：柴JZ006</p>","梁卫国李海峰教育"
"王媛代表：努力打造新区教育地标","东北网","2017-05-03 11:47:00",,"朋友圈升学考试教育"
